Filename,Title,Keywords,Category
"imagetheyusifahmad_Honey_Bee_isolated_on_white_--chaos_30_--ar_169_a16074f8-9983-4010-a7ed-9073fdfb6854_2.jpeg","a detailed watercolor painting of a honeybee in flight against a soft pink background","insect, bee, animal, nature, macro, close-up, honey, pollination, honey bee, yellow, pollen, flying, summer, isolated, fly, flower, backgrounds, animal wing, single flower, outdoors, wasp, small, multi colored, springtime, plant, illustration, collection, beauty in nature, biology, animals in the wild, working, stinging, white background, zoology, pattern","Animals"
"imagetheyusifahmad_White_blood_cells_under_a_Color_scanning_electr_cfb91ebc-23a4-4fa8-81e5-ccf22562ff9b_2.jpeg","Microscopic View: A Detailed Look at Red Blood Cells Under High Magnification","blood, healthcare and medicine, cell, blood cell, microbiology, science, magnification, backgrounds, microscope, illness, human cell, high-scale magnification, white blood cell, biology, close-up, bacterium, pattern, blood vessel, medicine, no people, artery, research, medical research, human artery, membrane, extreme close-up, vein, anatomy, flowing, hemoglobin, virus, immunology, bloodstream, shape, abstract","Science"
"imagetheyusifahmad_VECTOR_elegant_Wine_glass_and_fishbowl_on_a_gla_6dab8225-1179-45a6-90fd-8fa7d5c8ea17_3.jpeg","Crimson Koi: A Symphony of Red Fish in Glass Bowls","fish, animal, glass, material, drinking glass, liquid, backgrounds, water, fishbowl, close-up, alcohol, underwater, nature, goldfish, drink, wine, decoration, pets, food, wineglass, freshness, design, elegance, seafood, transparent, celebration, luxury, multi colored, illustration, table, abstract, motion, blue, single object, bubble","Animals"
"imagetheyusifahmad_Computer_generated_abstract_illustration_for_ba_23e4d37f-59a8-492a-9986-972dc8beed10_2.jpeg","vibrant swirls of blue, yellow, and black paint: an abstract fluid art masterpiece","abstract, backgrounds, multi colored, pattern, backdrop, blue, illustration, creativity, design, decoration, futuristic, shape, colors, motion, computer graphic, curve, fantasy, paint, wave, liquid, bright, yellow, chaos, ink, vibrant color, fractal, drop, dark, close-up, flame, water, space, vector, nature, wallpaper","Graphic Resources"
"imagetheyusifahmad_Photo-realistic_vector_illustration._Chocolates_92f7808d-1698-4348-a659-8b9ad3fe3c9c_3.jpeg","Dark chocolate cubes with hazelnuts and mint leaves in a brown cup on white background","chocolate, dessert, food, candy, sweet food, gourmet, close-up, broken, dark, milk, dark chocolate, snack, sugar, slice, backgrounds, chocolate bar, cacao fruit, stack, refreshment, unhealthy eating, indulgence, milk chocolate, freshness, eating, isolated, white background, fat, heap, ingredient, hot chocolate, studio shot, temptation, fudge, healthy eating, bowl","Food"
"imagetheyusifahmad_hot_air_balloon_isolated_on_a_white_background__257a0a5e-bbb8-4e84-a218-3ef1e29c6a6c_0.jpeg","a vibrant orange hot air balloon ascending against a clear white sky, a symbol of adventure and freedom","hot air balloon, flying, transportation, balloon, air vehicle, adventure, multi colored, fun, backgrounds, sport, travel, leisure activity, outdoors, heat, temperature, recreational pursuit, blue, summer, men, isolated, basket, illustration, inflatable, nature, levitation, extreme sports, moving up, mid-air, vacations, single object, helium balloon, inflating, journey, freedom, wind","Travel"
"imagetheyusifahmad_Card_for_invitation_or_congratulation_with_orch_372be7ff-4a0d-40b2-b68d-b212a699f1fa_3.jpeg","elegant white orchids on a gold geometric background; luxurious floral design","orchid, close-up, decoration, nature, plant, flower, leaf, backgrounds, petal, flower head, branch, tropical climate, beauty in nature, freshness, elegance, blossom, indoors, summer, ornate, botany, bouquet, pattern, decor, luxury, design, yellow, romance, moth orchid, green color, gift, multi colored, single object, illustration, celebration, bright","Plants and Flowers"
"imagetheyusifahmad_Blank_Book_Creative_Book_Presentation._Vector_I_0e18ecfd-a91e-4113-9cdc-78751920874a_1.jpeg","an open book with a bookmark, inviting you to discover new worlds of knowledge and adventure","book, education, literature, learning, library, reading, paper, illustration, textbook, vector, science, page, collection, symbol, book cover, studying, stack, dictionary, student, document, bookstore, bible, encyclopaedia, wisdom, yellow, bookmark, hardcover book, single object, publication, backgrounds, isolated, blue, bookshelf, flat, sign","Hobbies and Leisure"
"imagetheyusifahmad_3D_rendered_Illustration_of_the_surface_of_Plan_c03411d7-1a02-4437-9160-12e961d258d4_3.jpeg","a lone spacecraft on the crimson plains of a distant planet, a breathtaking view of alien landscapes","space, planet, nature, astronomy, galaxy, science, satellite, illustration, star, night, orbiting, spaceship, milky way, astronaut, nebula, futuristic, backgrounds, space travel vehicle, technology, mars, planet, space shuttle, sphere, atmosphere, dark, rocket, sun, dirt, outdoors, men, stratosphere, world map, topography, landscape, travel","Landscapes"
"imagetheyusifahmad_cute_card_with_flowers_--chaos_30_--ar_169_--st_780e5997-a518-47b7-9b7c-a5800f95518a_1.jpeg","Whimsical Meadow: A serene landscape of delicate white flowers, soft orange accents, and gentle butterflies dancing on a pale green background.","nature, flower, springtime, vector, backgrounds, summer, grass, illustration, plant, green color, meadow, season, daisy, blossom, design, pattern, leaf, beauty in nature, decoration, freshness, backdrop, growth, abstract, multi colored, outdoors, landscape, environment, floral pattern, day, cute, ornate, chamomile, wallpaper, colors, flat","Plants and Flowers"
"imagetheyusifahmad_Abstract_Background_Vector_--chaos_30_--ar_169__c4fd91ca-1285-49fe-bfe2-f4f15331c7b9_2.jpeg","Abstract cosmic sphere art: a vibrant explosion of colors and textures, swirling nebulae and glistening orbs in a mesmerizing dance of light and shadow.","backgrounds, multi colored, abstract, illustration, decoration, pattern, celebration, vector, backdrop, colors, design, vibrant color, creativity, shiny, fun, blue, shape, computer graphic, circle, bright, yellow, night, party, social event, fantasy, wallpaper, futuristic, season, nature, dark, illuminated, sphere, glowing, drop, curve","Graphic Resources"
"imagetheyusifahmad_Abstract_Background_Vector_--chaos_30_--ar_169__c4fd91ca-1285-49fe-bfe2-f4f15331c7b9_3.jpeg","Abstract red and black gradient circles background.  A mesmerizing blend of vibrant hues and organic shapes create a visually stunning backdrop.","backgrounds, abstract, pattern, backdrop, shiny, circle, multi colored, illustration, defocused, decoration, shape, design, bright, vector, colors, celebration, glowing, nature, illuminated, blue, creativity, wallpaper, space, night, dark, vibrant color, bubble, computer graphic, light, natural phenomenon, drop, wave, close-up, fantasy, freshness","Graphic Resources"
"imagetheyusifahmad_cute_card_with_flowers_--chaos_30_--ar_169_--st_780e5997-a518-47b7-9b7c-a5800f95518a_0.jpeg","Golden and Peach Floral Symphony: A Delicate Arrangement of Blossoms on a Soft Peach Background","nature, backgrounds, flower, pattern, vector, illustration, summer, decoration, backdrop, plant, design, leaf, abstract, blossom, wallpaper, season, springtime, ornate, yellow, floral pattern, computer graphic, multi colored, daisy, green color, colors, grass, textile, decor, beauty in nature, paper, design element, collection, beauty, single flower, cute","Plants and Flowers"
"imagetheyusifahmad_3D_rendered_Illustration_of_the_surface_of_Plan_c03411d7-1a02-4437-9160-12e961d258d4_2.jpeg","a mesmerizing scarlet landscape: undulating hills under a fiery sunset","nature, outdoors, landscape, sunset, backgrounds, rock, object, summer, sand, sunrise, dawn, dusk, sun, stone, object, blue, sunlight, beauty in nature, water, mountain, wave, close-up, cloud, sky, yellow, pattern, rural scene, dawn, coastline, travel, heat, temperature, season, night, land","Landscapes"
"imagetheyusifahmad_Blank_Book_Creative_Book_Presentation._Vector_I_0e18ecfd-a91e-4113-9cdc-78751920874a_0.jpeg","a light blue book opened to reveal its pages filled with text, ready for reading and knowledge exploration","book, education, literature, library, learning, reading, paper, document, page, textbook, isolated, book cover, hardcover book, science, blue, dictionary, catalog, publication, brochure, information medium, wisdom, illustration, diary, stack, studying, research, data, bookmark, white background, bookstore, blank, text, collection, single object, backgrounds","Hobbies and Leisure"
"imagetheyusifahmad_Card_for_invitation_or_congratulation_with_orch_372be7ff-4a0d-40b2-b68d-b212a699f1fa_2.jpeg","Elegant Orchids with Golden Accents: A Delicate Floral Design","orchid, nature, flower, plant, petal, flower head, close-up, decoration, blossom, leaf, white background, botany, beauty in nature, isolated, yellow, freshness, tropical climate, purple, elegance, backgrounds, beauty, bouquet, single flower, fragility, gold, moth orchid, branch, gift, design, romance, pattern, ornate, no people, studio shot, growth","Plants and Flowers"
"imagetheyusifahmad_hot_air_balloon_isolated_on_a_white_background__257a0a5e-bbb8-4e84-a218-3ef1e29c6a6c_1.jpeg","A breathtaking view from a vibrant red and white hot air balloon soaring through the sky, surrounded by a cluster of fellow balloons.","flying, hot air balloon, backgrounds, balloon, multi colored, sport, illustration, transportation, fun, air vehicle, leisure activity, celebration, design, travel, traditional festival, motion, abstract, vector, adventure, pattern, outdoors, freedom, summer, levitation, decoration, blue, activity, nature, cartoon, heat, temperature, wind, joy, basket, cultures","Travel"
"imagetheyusifahmad_Photo-realistic_vector_illustration._Chocolates_92f7808d-1698-4348-a659-8b9ad3fe3c9c_2.jpeg","Delicious dark chocolate pieces with hazelnuts and mint leaves: a tempting treat for chocolate lovers.","chocolate, food, dessert, candy, sweet food, broken, isolated, snack, gourmet, close-up, milk, dark chocolate, stack, white background, indulgence, slice, fat, hazelnut, chocolate bar, dark, almond, cacao fruit, sugar, studio shot, ingredient, cocoa bean, unhealthy eating, healthy eating, heap, eating, backgrounds, antioxidant, arrangement, macro, levitation","Food"
"imagetheyusifahmad_Computer_generated_abstract_illustration_for_ba_23e4d37f-59a8-492a-9986-972dc8beed10_3.jpeg","abstract orange and brown wavy lines background,  a mesmerizing 3d render of undulating stripes creating a dynamic and textured visual experience","sand dune, sand, pattern, nature, landscape, backgrounds, abstract, africa, wave, striped, outdoors, rippled, dry, design, illustration, sunset, wave pattern, heat, temperature, no people, environment, extreme terrain, shape, travel, backdrop, yellow, arid climate, curve, wallpaper, land, panoramic, wind, computer graphic, smooth, beauty","Graphic Resources"
"imagetheyusifahmad_Computer_generated_abstract_illustration_for_ba_23e4d37f-59a8-492a-9986-972dc8beed10_1.jpeg","Reflective spheres mirroring a mystical interior.","glass, material, reflection, indoors, backgrounds, close-up, drinking glass, table, transparent, single object, drink, sphere, decoration, design, shiny, lifestyles, liquid, vase, modern, crockery, architecture, illuminated, abstract, domestic room, crystal, multi colored, alcohol, no people, elegance, nature, blue, science, inside of, luxury, equipment","Graphic Resources"
"imagetheyusifahmad_Photo-realistic_vector_illustration._Chocolates_92f7808d-1698-4348-a659-8b9ad3fe3c9c_0.jpeg","Gourmet Hazelnut Chocolate Bonbons: A delectable collection of artisan chocolates, each a unique geometric masterpiece filled with the rich, nutty essence of hazelnuts.","chocolate, close-up, dessert, food, candy, sweet food, wood, material, backgrounds, gourmet, indulgence, snack, decoration, cookie, dark chocolate, sugar, table, cultures, variation, dark, studio shot, milk, macro, nature, no people, freshness, chocolate truffle, small, bowl, milk chocolate, almond, nut, craft, pumpkin, season","Food"
"imagetheyusifahmad_hot_air_balloon_isolated_on_a_white_background__257a0a5e-bbb8-4e84-a218-3ef1e29c6a6c_3.jpeg","A vibrant red and white striped hot air balloon soaring against a clear sky.","hot air balloon, transportation, flying, air vehicle, sport, adventure, travel, multi colored, balloon, leisure activity, backgrounds, fun, outdoors, basket, heat, temperature, recreational pursuit, mode of transport, isolated, summer, extreme sports, moving up, journey, nature, blue, activity, yellow, mid-air, vacations, levitation, wind, close-up, illustration, inflating, float","Travel"
"imagetheyusifahmad_Card_for_invitation_or_congratulation_with_orch_372be7ff-4a0d-40b2-b68d-b212a699f1fa_0.jpeg","Elegant white and orange orchids with gold ribbon and silver swirls background","flower, nature, plant, decoration, leaf, petal, backgrounds, orchid, blossom, close-up, flower head, water, christianity, freshness, shiny, gold, bouquet, beauty, gift, beauty in nature, wet, yellow, celebration, design, luxury, abstract, season, single flower, drop, elegance, decor, studio shot, wedding, love, isolated","Plants and Flowers"
"imagetheyusifahmad_Blank_Book_Creative_Book_Presentation._Vector_I_0e18ecfd-a91e-4113-9cdc-78751920874a_2.jpeg","a stack of blank books on a grey surface","book, education, paper, stack, document, literature, learning, textbook, page, blank, library, brochure, book cover, heap, hardcover book, reading, isolated, collection, illustration, business, backgrounds, single object, catalog, diary, publication, no people, office, design, space, science, table, sheet, information medium, empty, data","Hobbies and Leisure"
"imagetheyusifahmad_cute_card_with_flowers_--chaos_30_--ar_169_--st_780e5997-a518-47b7-9b7c-a5800f95518a_2.jpeg","A delicate corner border of peach-colored flowers and green leaves, perfect for adding a touch of elegance to your designs.","nature, flower, leaf, backgrounds, plant, decoration, pattern, blossom, illustration, summer, close-up, petal, design, flower head, abstract, frame, season, yellow, botany, ornate, multi colored, love, backdrop, green color, freshness, isolated, vector, beauty in nature, bouquet, wallpaper, autumn, gift, springtime, animal, celebration","Graphic Resources"
"imagetheyusifahmad_Abstract_Background_Vector_--chaos_30_--ar_169__c4fd91ca-1285-49fe-bfe2-f4f15331c7b9_1.jpeg","A cosmic journey through swirling nebulae and vibrant planets, a mesmerizing spectacle of celestial wonders.","backgrounds, abstract, space, galaxy, night, futuristic, glowing, science, astronomy, nebula, planet, illustration, star, technology, pattern, dark, backdrop, design, fantasy, multi colored, blue, illuminated, circle, motion, bright, exploding, shiny, sphere, wave, shape, computer graphic, satellite, star shape, decoration, nature","Science"
"imagetheyusifahmad_Abstract_Background_Vector_--chaos_30_--ar_169__c4fd91ca-1285-49fe-bfe2-f4f15331c7b9_0.jpeg","Abstract polygonal art: fiery nebula in shades of red and orange, glowing with cosmic energy. A digital painting of a vibrant space scene.","abstract, backgrounds, geometric shape, shape, pattern, backdrop, modern, futuristic, triangle shape, design, illustration, computer graphic, two-dimensional shape, dark, creativity, multi colored, vector, low, bright, colors, technology, shiny, light, natural phenomenon, wallpaper, decoration, mosaic, sparse, science, glowing, night, space, internet, geometry, crystal","Graphic Resources"
"imagetheyusifahmad_cute_card_with_flowers_--chaos_30_--ar_169_--st_780e5997-a518-47b7-9b7c-a5800f95518a_3.jpeg","Delicate blush pink and sage green floral illustration design; perfect for wedding invitations or feminine branding.","nature, backgrounds, vector, illustration, abstract, flower, leaf, plant, backdrop, decoration, pattern, design, summer, blossom, wallpaper, season, branch, ornate, computer graphic, floral pattern, springtime, beauty, colors, multi colored, grass, silhouette, decor, modern, autumn, shape, creativity, beauty in nature, design element, single flower, green color","Graphic Resources"
"imagetheyusifahmad_3D_rendered_Illustration_of_the_surface_of_Plan_c03411d7-1a02-4437-9160-12e961d258d4_1.jpeg","Martian landscape: a breathtaking view of the rusty, rocky terrain under a vibrant sunset","nature, outdoors, backgrounds, close-up, summer, water, wave, wet, abstract, landscape, sunset, mountain, yellow, beauty in nature, rock, object, macro, sunlight, pattern, liquid, freshness, drop, sand, heat, temperature, blue, sun, season, dusk, autumn, ice, reflection, forest, multi colored, stone, object","Landscapes"
"imagetheyusifahmad_Blank_Book_Creative_Book_Presentation._Vector_I_0e18ecfd-a91e-4113-9cdc-78751920874a_3.jpeg","a thick book with pages fanned out wide, showing the depth of its contents. the book has a vibrant blue cover and sits on a plain white background","book, education, literature, stack, learning, paper, document, reading, isolated, library, information medium, page, data, textbook, white background, publication, research, wisdom, studying, heap, text, catalog, book cover, collection, no people, hardcover book, archives, science, expertise, bookstore, paperwork, ideas, blue, dictionary, single object","Hobbies and Leisure"
"imagetheyusifahmad_Card_for_invitation_or_congratulation_with_orch_372be7ff-4a0d-40b2-b68d-b212a699f1fa_1.jpeg","Elegant golden orchids with a satin ribbon and decorative elements on a textured background","decoration, backgrounds, gift, celebration, decor, winter, orchid, gold, ornate, design, shiny, christmas ornament, christmas decoration, gold colored, close-up, nature, snow, elegance, luxury, candle, greeting, snowflake, yellow, flower, wood, material, branch, bright, season, pattern, indoors, symbol, event, plant, space","Graphic Resources"
"imagetheyusifahmad_hot_air_balloon_isolated_on_a_white_background__257a0a5e-bbb8-4e84-a218-3ef1e29c6a6c_2.jpeg","A fiery orange hot air balloon ascends against a clear sky, a breathtaking view of aerial adventure.","hot air balloon, transportation, flying, air vehicle, sport, travel, backgrounds, adventure, balloon, multi colored, illustration, isolated, fun, levitation, blue, leisure activity, outdoors, nature, mode of transport, journey, extreme sports, yellow, basket, sphere, activity, summer, heat, temperature, single object, space, recreational pursuit, mid-air, float, abstract, design","Travel"
"imagetheyusifahmad_Photo-realistic_vector_illustration._Chocolates_92f7808d-1698-4348-a659-8b9ad3fe3c9c_1.jpeg","a delectable pile of milk chocolate hazelnut candies, each one a rich and creamy delight.","chocolate, dessert, sweet food, food, gourmet, close-up, candy, snack, refreshment, sugar, backgrounds, freshness, unhealthy eating, dark, stack, slice, fat, eating, indulgence, milk, dark chocolate, white background, meal, isolated, cute, celebration, broken, temptation, decoration, cream, cacao fruit, illustration, baked, collection, heap","Food"
"imagetheyusifahmad_Computer_generated_abstract_illustration_for_ba_23e4d37f-59a8-492a-9986-972dc8beed10_0.jpeg","A mesmerizing fractal artwork in vibrant reds and oranges, showcasing intricate patterns and symmetrical designs.","multi colored, backgrounds, illustration, abstract, pattern, decoration, futuristic, fractal, design, creativity, fantasy, curve, animal, colors, shape, vibrant color, reflection, motion, modern, bright, computer graphic, backdrop, celebration, painted image, flame, space, architecture, chaos, yellow, shiny, science, spiral, casino, stage, performance space","Graphic Resources"
"imagetheyusifahmad_Broken_Brick_Wall_with_beautiful_landscape_behi_0cb21f11-6be5-4c72-baf1-b9c638a5ecba_2.jpeg","A glimpse of the city through a crumbling brick wall","brick, architecture, old, outdoors, wall, building feature, brick wall, construction industry, material, built structure, old ruin, stack, backgrounds, building exterior, history, nature, stone material, ancient, cement, ruined, weathered, building, activity, design, damaged, famous place, dirty, pattern, concrete, rough, blue, day, roof, abandoned, industry","Buildings and Architecture"
"imagetheyusifahmad_Wasting_time_concept_alarm_clocks_in_the_trash__209f7656-63e3-4767-9c6b-72f27ba18df1_1.jpeg","A pile of forgotten clocks, weathered and overgrown, rests amidst fallen leaves, hinting at the passage of time and the stillness of a forgotten place.","clock, old, time, old-fashioned, alarm clock, antique, clock face, obsolete, minute hand, watch, single object, second hand, clock hand, technology, countdown, broken, metal, dirty, timer, outdoors, table, night, close-up, abandoned, number, stack, day, nature, damaged, indoors, collection, heap, wood, material, reminder","The Environment"
"imagetheyusifahmad_Background_image_of_3D_--chaos_30_--ar_169_--st_64bdda58-3301-46c0-a4c8-840ab8d75ad7_3.jpeg","Abstract composition of red and black glossy spheres, a mesmerizing 3D render of floating bubbles.","backgrounds, multi colored, decoration, balloon, sphere, celebration, close-up, abstract, illustration, ball, circle, shiny, flying, fun, reflection, colors, pattern, design, drop, blue, science, birthday, creativity, shape, vibrant color, space, bubble, helium, party, social event, levitation, joy, bright, nature, toy","Graphic Resources"
"imagetheyusifahmad_Planet_earth_in_space_with_focus_on_European_co_69d3ef8e-6488-423a-8d4e-20b0931d18c0_2.jpeg","Our fragile earth: a giant globe rests on a verdant hillside, overlooking a serene valley and snow-capped mountains.","nature, environment, planet, space, grass, sphere, map, global, blue, land, computer graphic, mountain, landscape, world map, physical geography, meadow, tree, travel, sunlight, cloud, sky, forest, farm, planet earth, wide, ball, technology, topography, horizon, computer, sunset, outdoors, environmental conservation, cartography, sun","The Environment"
"imagetheyusifahmad_Set_of_Colorful_Scotch_adhesive_Tape_--chaos_30_5abd4cb5-da3b-4d13-bff6-62959bae9832_1.jpeg","Vibrant rolls of colorful transparent plastic sheets, ideal for various creative and industrial applications.","blue, multi colored, plastic, backgrounds, illustration, isolated, green color, close-up, single object, yellow, fun, colors, equipment, liquid, design, no people, white background, circle, leisure games, toy, bottle, decoration, sport, pink color, symbol, creativity, abstract, computer graphic, shape, pattern, tube, concepts, childhood, shiny, material","Industry"
"imagetheyusifahmad_U.S.A_3D_map_symbol_represented_by_a_blue_dimen_2b1d8bb9-061d-4f4e-912d-56c13fc893b1_0.jpeg","A somber statue stands sentinel over a textured map, a poignant representation of history and place.","blue, men, metal, rusty, old, outdoors, nature, one person, steel, dirty, grunge, close-up, damaged, water, backgrounds, illustration, industry, working, weathered, ice, equipment, adult, machinery, iron, abstract, dark, technology, danger, scuba diving, sport, travel, women, winter, concepts, animal","Culture and Religion"
"imagetheyusifahmad_U.S.A_3D_map_symbol_represented_by_a_blue_dimen_2b1d8bb9-061d-4f4e-912d-56c13fc893b1_1.jpeg","a blue 3d model of a city on a wooden surface","blue, abstract, technology, concepts, backgrounds, digitally generated image, communication, ideas, global communications, map, world map, data, illustration, science, design, business, pattern, no people, internet, industry, global, shape, computer graphic, education, computer, global business, men, symbol, connection, businessman, success, three dimensional, backdrop, equipment, business finance and industry","Buildings and Architecture"
"imagetheyusifahmad_Set_of_Colorful_Scotch_adhesive_Tape_--chaos_30_5abd4cb5-da3b-4d13-bff6-62959bae9832_0.jpeg","a collection of colorful adhesive tapes in various shades, tightly wound and ready for use","multi colored, blue, close-up, colors, backgrounds, circle, yellow, rolled up, spool, equipment, material, pink color, single object, plastic, pattern, variation, isolated, arrangement, stack, abstract, purple, design, hobbies, paint, green color, industry, collection, craft, vibrant color, creativity, sport, paper, curve, decoration, clothing","Graphic Resources"
"imagetheyusifahmad_Planet_earth_in_space_with_focus_on_European_co_69d3ef8e-6488-423a-8d4e-20b0931d18c0_3.jpeg","A breathtaking panoramic view of earth from space, showcasing the planet's majestic mountains and the ethereal beauty of clouds swirling across its surface.","nature, water, mountain, landscape, sun, space, planet, travel, outdoors, adventure, sunset, blue, sunlight, wave, coastline, high angle view, sand, environment, day, aerial view, exploration, snow, mountain range, flying, science, majestic, stratosphere, high up, mountain peak, atmosphere, africa, land, physical geography, seascape, cliff","Landscapes"
"imagetheyusifahmad_Background_image_of_3D_--chaos_30_--ar_169_--st_64bdda58-3301-46c0-a4c8-840ab8d75ad7_2.jpeg","A mesmerizing abstract of iridescent bubbles suspended in a dark liquid, creating a captivating visual symphony of light and texture.","backgrounds, abstract, bubble, close-up, nature, drop, sphere, liquid, blue, wet, macro, water, multi colored, circle, reflection, transparent, science, motion, shiny, pattern, wave, illustration, underwater, space, design, futuristic, creativity, planet, bright, splashing, backdrop, freshness, colors, ball, glass, material","Graphic Resources"
