Filename,Title,Keywords,Category
"imagetheyusifahmad_Beautiful_sunset_--chaos_30_--ar_169_--stylize__9ec928ef-5496-4b38-90e0-efaf8b7a58e6_2.jpeg","Surreal sunset landscape: coral trees emerging from a calm, orange-hued ocean under a dramatic sky.","nature, sunset, water, summer, outdoors, cloud, sky, sunlight, sun, landscape, dusk, blue, wave, reflection, beauty in nature, sand, sunrise, dawn, season, yellow, multi colored, vacations, tropical climate, seascape, backgrounds, tree, tranquil scene, travel, day, autumn, plant, coastline, leaf, heat, temperature","Landscapes"
"imagetheyusifahmad_Earth_-_vector_illustration_in_three_colors_-_e_340bb3fb-a22a-4ac1-8847-40613a7c6d81_0.jpeg","Green earth triptych: a stylized depiction of our planet in shades of green, emphasizing environmental themes.","planet, space, nature, world map, sphere, vector, illustration, backgrounds, africa, map, abstract, environment, water, blue, land, design, global, cartography, drop, collection, symbol, physical geography, grunge, space, isolated, set, computer graphic, circle, backdrop, shape, global business, green color, leaf, silhouette, dirt","The Environment"
"imagetheyusifahmad_concept_of_sustainable_development_with_Cube_pu_a9b2ca97-c6b6-42db-9771-dc22bd5fbefd_3.jpeg","a sky reflected in puzzle pieces under autumn trees","puzzle, blue, cloud, sky, solution, ideas, jigsaw puzzle, success, concepts, connection, strategy, nature, part of, pattern, teamwork, creativity, abstract, backgrounds, business, outdoors, sunset, sunlight, togetherness, landscape, environment, absence, community, leisure games, inspiration, multi colored, no people, yellow, sun, design, order","The Environment"
"imagetheyusifahmad_miniature_golf_planet_concept_with_nice_grass_c_9daf4bca-7952-4152-911f-d0c772d7d017_3.jpeg","A lush green landscape featuring a charming house nestled on a hill, with a spherical bush in the foreground.","grass, golf, sport, golf course, ball, lawn, nature, outdoors, landscape, meadow, summer, green color, activity, tree, turf, sunlight, sun, hobbies, blue, golf ball, no people, leisure activity, illustration, computer graphic, farm, design, shadow, club, plant, playing, land, hole, relaxation, environment, sand","Landscapes"
"imagetheyusifahmad_3D_render_of_a_lantern_--chaos_30_--ar_169_--st_d245c2d9-633b-4bc3-beae-c60321a63087_0.jpeg","a glowing lantern on a wooden path in a dark forest","lantern, outdoors, electric lamp, wood, material, nature, flame, lighting equipment, single object, old-fashioned, tree, fire, natural phenomenon, backgrounds, old, candle, close-up, decoration, night, illuminated, antique, cultures, forest, rustic, glowing, table, summer, metal, heat, temperature, green color, dark, equipment, celebration, space","Landscapes"
"imagetheyusifahmad_3d_tree_pack_-_render_on_white_background_--cha_b4467a15-b2a3-4b87-a0f5-d0b72bd4b160_2.jpeg","a row of lush willow trees against a bright white background","tree, nature, plant, grass, branch, green color, leaf, summer, meadow, isolated, landscape, outdoors, agriculture, season, rural scene, farm, growth, forest, springtime, environment, land, fruit, freshness, no people, organic, day, tree trunk, backgrounds, flower, non-urban scene, beauty in nature, white background, in a row, design, lawn","Plants and Flowers"
"imagetheyusifahmad_globe_with_twisted_diagram_of_golden_coins_isol_ef9b7a9a-85c8-432f-8d28-200a786c0569_0.jpeg","a vintage globe encircled by a ring of gold coins, symbolizing global finance and travel","map, world map, travel, cartography, close-up, sphere, planet, space, antique, macro, global business, topography, old-fashioned, wealth, currency, education, selective focus, journey, global, old, physical geography, ideas, finance, concepts, no people, backgrounds, nature, coin, paper, vacations, exploration, africa, success, gold, tourism","Business"
"imagetheyusifahmad_3D_balls_--chaos_30_--ar_169_--stylize_300_--we_c276c929-bee2-4b98-b9dd-e9d2fa87b260_1.jpeg","Abstract spheres in teal and brown with inner reflections and details.","close-up, backgrounds, science, blue, multi colored, abstract, illustration, macro, sphere, glass, material, molecular structure, green color, pattern, circle, liquid, research, healthcare and medicine, medicine, nature, biology, drop, laboratory, chemistry, shiny, shape, microbiology, technology, reflection, three dimensional, single object, bacterium, wet, decoration, futuristic","Graphic Resources"
"imagetheyusifahmad_Accident_of_a_red_car_isolated_on_a_white_backg_81830cea-644d-4cee-9c76-68b3fe08d6f3_3.jpeg","A severely damaged red car after a collision, showing extensive body damage and crushed components.","car, land vehicle, transportation, crash, damaged, misfortune, broken, tire, close-up, wreck, car accident, repairing, mode of transport, outdoors, demolished, wheel, metal, speed, danger, machinery, service, traffic, bumper, industry, engine, destruction, dirty, ruined, brake, mechanic, steel, driving, technology, rubber, rescue","Transport"
"imagetheyusifahmad_St._Patricks_hat_with_four-leaf_clover._3d_imag_88324c3e-dcbf-480b-a7d0-70d17969e5a8_2.jpeg","a green leprechaun hat with a four-leaf clover","green color, leaf, celebration, irish culture, cultures, leprechaun, clover, decoration, close-up, luck, isolated, white background, nature, single object, fashion, clothing, backgrounds, season, felt, personal accessory, day, symbol, gold, plant, top hat, no people, textile, studio shot, elegance, ideas, old-fashioned, men, concepts, buckle, cut out","Culture and Religion"
"imagetheyusifahmad_branch_with_fresh_green_leaves_--chaos_30_--ar__22a1841a-7d3e-45cb-869e-a99da67f8abd_2.jpeg","A delicate branch adorned with vibrant, young leaves against a soft, light background.","leaf, nature, tree, branch, plant, backgrounds, season, outdoors, close-up, green color, freshness, summer, forest, springtime, beauty in nature, growth, day, autumn, bright, pattern, botany, yellow, environment, vibrant color, sunlight, abstract, macro, colors, twig, blue, design, flower, organic, vector, decoration","Plants and Flowers"
"imagetheyusifahmad_Modern_Architecture_--chaos_30_--ar_169_--styli_368a7455-7c22-4f7a-82cf-fdc029a4e0ee_2.jpeg","Serene sanctuary: a modern architectural marvel nestled amidst a bamboo grove, offering a tranquil escape in an urban oasis.","men, abstract, architecture, walking, businessman, adult, motion, futuristic, indoors, window, flooring, design, illustration, women, modern, skyscraper, backgrounds, computer graphic, corridor, one person, blurred motion, built structure, speed, reflection, tree, cityscape, city life, running, computer, lifestyles, businesswoman, nature, technology, success, digitally generated image","Buildings and Architecture"
"imagetheyusifahmad_Modern_Architecture_--chaos_30_--ar_169_--styli_368a7455-7c22-4f7a-82cf-fdc029a4e0ee_3.jpeg","A modern architectural marvel: a captivating design of angular forms and serene waterfront setting.","architecture, outdoors, modern, building exterior, famous place, built structure, skyscraper, city life, travel, cityscape, design, water, travel destinations, sport, tourism, nautical vessel, motion, creativity, summer, men, construction industry, futuristic, nature, transportation, day, reflection, adult, commercial dock, night, window, concrete, editorial, new, blue, fun","Buildings and Architecture"
"imagetheyusifahmad_branch_with_fresh_green_leaves_--chaos_30_--ar__22a1841a-7d3e-45cb-869e-a99da67f8abd_3.jpeg","A branch with vibrant green maple leaves, a symbol of spring's renewal and nature's beauty","leaf, nature, green color, plant, tree, summer, vector, backgrounds, environment, branch, freshness, season, illustration, growth, forest, springtime, botany, pattern, beauty in nature, abstract, isolated, design, close-up, vibrant color, bright, colors, autumn, organic, yellow, outdoors, collection, design element, multi colored, symbol, macro","Plants and Flowers"
"imagetheyusifahmad_St._Patricks_hat_with_four-leaf_clover._3d_imag_88324c3e-dcbf-480b-a7d0-70d17969e5a8_3.jpeg","A festive green leprechaun hat with a shamrock on an orange background.","green color, celebration, leaf, irish culture, cultures, leprechaun, backgrounds, yellow, decoration, fashion, clover, close-up, single object, luck, day, gold, nature, symbol, men, clothing, personal accessory, season, top hat, elegance, textile, gold colored, old-fashioned, party, social event, no people, felt, costume, event, shiny, design","Culture and Religion"
"imagetheyusifahmad_Accident_of_a_red_car_isolated_on_a_white_backg_81830cea-644d-4cee-9c76-68b3fe08d6f3_2.jpeg","A severely damaged red car after a serious accident, showing extensive front-end and side damage.","car, crash, land vehicle, damaged, transportation, misfortune, broken, wreck, speed, car accident, dirty, demolished, destruction, mode of transport, ruined, close-up, tire, bumper, wheel, danger, outdoors, traffic, metal, crushed, driving, extreme sports, dirt, sport, engine, old, industry, breaking, chrome, off-road vehicle, traffic accident","Transport"
"imagetheyusifahmad_3D_balls_--chaos_30_--ar_169_--stylize_300_--we_c276c929-bee2-4b98-b9dd-e9d2fa87b260_0.jpeg","A mesmerizing cluster of rose gold spheres, reflecting light and creating a captivating abstract scene.","backgrounds, abstract, illustration, decoration, sphere, shiny, pattern, design, shape, reflection, circle, science, futuristic, creativity, fractal, backdrop, computer graphic, multi colored, technology, fantasy, three dimensional, ball, glass, material, bright, digitally generated image, celebration, curve, modern, blue, space, close-up, molecular structure, medicine, symbol","Graphic Resources"
"imagetheyusifahmad_globe_with_twisted_diagram_of_golden_coins_isol_ef9b7a9a-85c8-432f-8d28-200a786c0569_1.jpeg","a vintage globe adorned with gold coins, symbolizing global finance and travel","map, world map, planet, space, sphere, cartography, topography, global business, physical geography, africa, global, isolated, global communications, science, travel, backgrounds, close-up, macro, ideas, concepts, nature, land, gold, space, environment, illustration, single object, gold colored, antique, desktop globe, education, old, no people, technology, globe, navigational equipment","Business"
"imagetheyusifahmad_3d_tree_pack_-_render_on_white_background_--cha_b4467a15-b2a3-4b87-a0f5-d0b72bd4b160_3.jpeg","Three majestic willow trees standing tall against a bright white background, showcasing their lush green foliage and intricate bark textures.","tree, nature, plant, grass, summer, branch, landscape, leaf, forest, isolated, outdoors, green color, meadow, rural scene, season, environment, sunset, growth, springtime, backgrounds, tree trunk, day, illustration, land, non-urban scene, sunlight, sun, farm, autumn, no people, silhouette, beauty in nature, back lit, botany, agriculture","Plants and Flowers"
"imagetheyusifahmad_3D_render_of_a_lantern_--chaos_30_--ar_169_--st_d245c2d9-633b-4bc3-beae-c60321a63087_1.jpeg","a glowing copper lantern on a wooden table near a window","lantern, electric lamp, single object, glass, material, lighting equipment, flame, fire, natural phenomenon, old-fashioned, close-up, old, illuminated, heat, temperature, candle, glowing, indoors, wood, material, antique, decoration, backgrounds, table, equipment, metal, domestic room, shiny, light bulb, home interior, burning, candlelight, dark, design, bright","Lifestyle"
"imagetheyusifahmad_miniature_golf_planet_concept_with_nice_grass_c_9daf4bca-7952-4152-911f-d0c772d7d017_2.jpeg","a mossy globe resting on a lush green lawn with a house in the background","grass, ball, golf, sport, golf course, lawn, nature, green color, outdoors, tree, summer, turf, golf ball, hole, meadow, leisure activity, hobbies, playing, activity, no people, sphere, landscape, club, leisure games, day, putting green, plant, playing field, relaxation, tee, success, environment, backgrounds, competition, table","The Environment"
"imagetheyusifahmad_concept_of_sustainable_development_with_Cube_pu_a9b2ca97-c6b6-42db-9771-dc22bd5fbefd_2.jpeg","a girl sitting inside a giant puzzle cube in a field with wind turbines in the background","nature, grass, outdoors, women, tree, men, environment, cloud, sky, meadow, landscape, summer, adult, blue, sitting, sunset, farm, one person, green color, sunlight, growth, sun, technology, rural scene, relaxation, young adult, agriculture, environmental conservation, plant, land, architecture, concepts, lifestyles, computer, ideas","The Environment"
"imagetheyusifahmad_Earth_-_vector_illustration_in_three_colors_-_e_340bb3fb-a22a-4ac1-8847-40613a7c6d81_1.jpeg","three globes representing our planet earth showing different continents and oceans","planet, space, world map, sphere, map, africa, cartography, physical geography, global communications, global business, global, isolated, illustration, topography, space, blue, travel, nature, white background, concepts, land, environment, communication, science, technology, computer graphic, ideas, symbol, abstract, backgrounds, desktop globe, business travel, shiny, orbiting, internet","The Environment"
"imagetheyusifahmad_Beautiful_sunset_--chaos_30_--ar_169_--stylize__9ec928ef-5496-4b38-90e0-efaf8b7a58e6_3.jpeg","a breathtaking sunset with fiery clouds and sun rays illuminating the horizon","sunset, nature, sun, sunlight, dusk, landscape, outdoors, summer, dawn, cloud, sky, yellow, sunrise, beauty in nature, weather, blue, back lit, tranquil scene, backgrounds, silhouette, horizon, season, mountain, heaven, day, environment, idyllic, no people, rural scene, horizon over land, vibrant color, grass, non-urban scene, bright, panoramic","Landscapes"
"imagetheyusifahmad_bobbins._3d_--chaos_30_--ar_169_--stylize_300_-_f00c3a80-2e81-4e17-b1f9-878c67873305_2.jpeg","A multitude of intricately woven spherical towers in an old building, creating a mesmerizing and complex visual texture.","wood, material, toy, leisure games, sport, close-up, sphere, education, multi colored, abacus, fun, backgrounds, cultures, success, creativity, ball, single object, leisure activity, concepts, strategy, competition, abstract, ideas, playing, order, equipment, finance, blue, large, group of objects, indoors, pattern, science, old, yellow","Graphic Resources"
"imagetheyusifahmad_ball_for_golf_on_a_red_background_--chaos_30_--_8c74a908-6ff0-484f-b77e-6c9b548d7dd9_2.jpeg","a crimson golf ball under the warm sunlight","sport, ball, close-up, equipment, macro, backgrounds, single object, competition, pattern, no people, leather, studio shot, abstract, baseball, shadow, sports equipment, shape, activity, copy space, sphere, circle, night, leisure games, success, indoors, speed, bright, playing, blue, flame, design, fun, dark, team sport, selective focus","Sports"
"imagetheyusifahmad_Environmental_concept._Tree_forming_the_world_g_49b3c31c-fafb-416a-a931-552239801299_3.jpeg","a tree forming the shape of the earth, symbolizing the interconnectedness of nature and our planet's delicate ecosystem","tree, nature, branch, environment, leaf, plant, forest, outdoors, tree trunk, growth, backgrounds, abstract, season, day, travel, africa, no people, old, landscape, autumn, green color, isolated, pattern, land, design, symbol, botany, silhouette, winter, grass, blue, close-up, water, planet, space","The Environment"
"imagetheyusifahmad_Bright_abstract_background_--chaos_30_--ar_169__69a14efd-ddad-4cb8-ac34-6b5ea269d05a_1.jpeg","abstract colorful strokes and splatters digital painting","abstract, backgrounds, multi colored, backdrop, pattern, illustration, design, creativity, curve, colors, futuristic, decoration, motion, vibrant color, computer graphic, bright, modern, blue, celebration, shape, yellow, fantasy, wave, vector, paint, wallpaper, space, fractal, glowing, rainbow, striped, shiny, grunge, fun, blurred motion","Graphic Resources"
"imagetheyusifahmad_Three_dimensional_render_of_stack_of_purple_rin_a85c4add-adde-4aea-af08-f3ab9ef5b076_2.jpeg","Serene stack of purple glass pebbles, a minimalist zen-like arrangement against a pale pink backdrop.","close-up, pink color, backgrounds, shiny, reflection, capsule, transparent, single object, glass, material, multi colored, blue, liquid, shape, circle, decoration, purple, no people, medicine, sphere, colors, studio shot, abstract, plastic, gemstone, healthcare and medicine, creativity, nature, isolated, design, pill, crystal, beauty, wet, science","States of Mind"
"imagetheyusifahmad_Tropical_island_wave_and_surfer_at_sunset_--cha_e29a8438-d1af-43a9-9791-0261bd171f90_2.jpeg","Golden sunset surf session: two surfers riding majestic waves at sunset.","sunset, men, nature, outdoors, sport, summer, extreme sports, surfboard, sun, wave, sunlight, adventure, vacations, water, surfing, sunrise, dawn, recreational pursuit, dusk, back lit, nautical vessel, activity, exercising, adult, surf, fun, speed, sand, leisure activity, beauty in nature, one person, landscape, silhouette, sailing, travel","Sports"
"imagetheyusifahmad_Blue_top_hat_with_rabbit_ears_isolated_on_yello_06b8c607-27eb-46fa-adb2-18ab3a981bc3_3.jpeg","A blue top hat with rabbit ears against a yellow background.  A whimsical and magical image.","celebration, close-up, backgrounds, single object, decoration, yellow, animal, rabbit, cute, fashion, isolated, cultures, symbol, christianity, clothing, religion, studio shot, wood, material, gift, blue, fluffy, no people, multi colored, season, colors, toy, small, nature, elegance, design, party, social event, personal accessory, yellow background","Hobbies and Leisure"
"imagetheyusifahmad_wooden_crate_full_of_oranges._Isolated_3d_rende_a2ef2db8-bb5c-4e59-9fe5-f083fbd2204d_2.jpeg","A rustic wooden crate overflowing with vibrant, juicy oranges, some halved, showcasing their freshness.","fruit, wood, material, freshness, food, nature, healthy eating, organic, ripe, orange, crate, citrus fruit, close-up, box, container, vegetarian food, agriculture, isolated, backgrounds, tangerine, dieting, yellow, lemon, vegetable, sweet food, basket, leaf, refreshment, summer, gourmet, meal, white background, eating, orange color, single object","Food"
"imagetheyusifahmad_Three_dimensional_render_of_springtime_meadow_o_c17b4305-c85c-4c0a-ab08-532bf0a5526e_1.jpeg","A mossy stone sphere rests serenely in a verdant valley, bathed in the soft light of dawn. The ancient, enigmatic orb is nestled amongst gently rolling hills and lush vegetation, creating a scene of ethereal beauty and quiet mystery.","nature, grass, farm, rural scene, outdoors, agriculture, tree, landscape, meadow, forest, autumn, plant, green color, summer, season, leaf, fog, mountain, non-urban scene, land, old, travel, food, environment, ball, sphere, bale, sun, architecture, sunset, blue, sunlight, no people, fruit, yellow","Landscapes"
"imagetheyusifahmad_Three_dimensional_render_of_springtime_meadow_o_c17b4305-c85c-4c0a-ab08-532bf0a5526e_0.jpeg","Enigmatic stone spheres nestled amidst lush forest greenery and vibrant wildflowers.","nature, outdoors, summer, farm, agriculture, fruit, green color, flower, grass, rural scene, plant, freshness, food, melon, organic, meadow, ripe, pumpkin, season, watermelon, healthy eating, vegetable, growth, autumn, leaf, yellow, non-urban scene, harvesting, sunflower, vegetarian food, close-up, formal garden, landscape, backgrounds, flower head","Landscapes"
"imagetheyusifahmad_wooden_crate_full_of_oranges._Isolated_3d_rende_a2ef2db8-bb5c-4e59-9fe5-f083fbd2204d_3.jpeg","a crate full of fresh oranges ready for market","fruit, freshness, food, ripe, organic, nature, healthy eating, orange, citrus fruit, wood, material, crate, close-up, agriculture, box, container, basket, tangerine, yellow, isolated, vegetarian food, leaf, dieting, backgrounds, farm, sweet food, lemon, orange color, refreshment, summer, meal, green color, full, vegetable, white background","Food"
"imagetheyusifahmad_Blue_top_hat_with_rabbit_ears_isolated_on_yello_06b8c607-27eb-46fa-adb2-18ab3a981bc3_2.jpeg","A mysterious blue top hat with rabbit ears against a vibrant yellow background","yellow, celebration, single object, backgrounds, decoration, close-up, gift, blue, fashion, design, elegance, season, yellow background, multi colored, clothing, symbol, isolated, wood, material, no people, cultures, copy space, studio shot, creativity, love, space, romance, birthday, religion, event, concepts, ideas, nature, men, colors","Graphic Resources"
"imagetheyusifahmad_Tropical_island_wave_and_surfer_at_sunset_--cha_e29a8438-d1af-43a9-9791-0261bd171f90_3.jpeg","Serene sunset surf: a surfer finds tranquility on a golden wave","men, wave, surfboard, outdoors, sport, sunset, surfing, nature, water, adult, extreme sports, adventure, summer, one person, fun, surf, speed, activity, recreational pursuit, vacations, sunlight, motion, leisure activity, sun, travel, dusk, sand, lifestyles, blue, exercising, healthy lifestyle, illustration, copy space, wet, young adult","Sports"
"imagetheyusifahmad_Three_dimensional_render_of_stack_of_purple_rin_a85c4add-adde-4aea-af08-f3ab9ef5b076_3.jpeg","A rose-gold spiral in a minimalist pink room: interior design concept.","indoors, domestic room, spiral, flooring, modern, no people, metal, backgrounds, clean, home interior, equipment, toy, close-up, steel, decoration, shiny, design, bright, single object, industry, technology, bouncing, table, wood, material, machinery, abstract, pattern, curve, decor, childhood, new, fun, service, twisted","Buildings and Architecture"
"imagetheyusifahmad_Bright_abstract_background_--chaos_30_--ar_169__69a14efd-ddad-4cb8-ac34-6b5ea269d05a_0.jpeg","abstract swirling patterns in pink, green, and yellow hues: a vibrant digital artwork","backgrounds, abstract, multi colored, illustration, pattern, backdrop, circle, shape, curve, green color, design, computer graphic, colors, decoration, creativity, futuristic, fantasy, vibrant color, pink color, blue, nature, shiny, fractal, vector, close-up, technology, bright, motion, modern, wave, space, wallpaper, yellow, digitally generated image, freshness","Graphic Resources"
"imagetheyusifahmad_Environmental_concept._Tree_forming_the_world_g_49b3c31c-fafb-416a-a931-552239801299_2.jpeg","a lush green tree with the earth as its fruit: a symbol of environmental preservation and hope for a sustainable future","tree, nature, grass, environment, forest, green color, land, plant, meadow, computer graphic, landscape, illustration, leaf, growth, outdoors, summer, global, blue, lawn, environmental conservation, cloud, sky, branch, planet, space, backgrounds, tree trunk, sphere, no people, day, ideas, abstract, season, sunlight, dirt","The Environment"
"imagetheyusifahmad_Environmental_concept._Tree_forming_the_world_g_49b3c31c-fafb-416a-a931-552239801299_0.jpeg","a small tree supporting the weight of the world: a symbolic representation of environmental responsibility","nature, planet, space, environment, leaf, sphere, close-up, tree, plant, world map, blue, growth, backgrounds, science, concepts, macro, technology, water, abstract, global, africa, illustration, ideas, animal, space, dirt, symbol, global business, branch, global communications, environmental conservation, futuristic, green color, no people, travel","The Environment"
"imagetheyusifahmad_Three_dimensional_render_of_stack_of_purple_rin_a85c4add-adde-4aea-af08-f3ab9ef5b076_1.jpeg","Serene Stacking: Three Lavender Stones on a Pastel Surface","close-up, pink color, backgrounds, stack, no people, blue, abstract, concepts, purple, studio shot, design, heap, shape, nature, single object, shiny, symbol, creativity, sphere, toy, indoors, decoration, three objects, reflection, illustration, multi colored, balance, healthy lifestyle, animal, collection, isolated, ideas, arrangement, ball, circle","States of Mind"
"imagetheyusifahmad_Bright_abstract_background_--chaos_30_--ar_169__69a14efd-ddad-4cb8-ac34-6b5ea269d05a_2.jpeg","Abstract swirling vortex of vibrant colors: an explosion of hues and textures in dynamic composition.","abstract, backgrounds, multi colored, illustration, backdrop, pattern, creativity, colors, vibrant color, modern, vector, computer graphic, design, bright, shape, decoration, futuristic, curve, motion, circle, night, technology, striped, yellow, glowing, blue, grunge, painted image, dark, illuminated, wallpaper, shiny, blurred motion, celebration, space","Graphic Resources"
"imagetheyusifahmad_Tropical_island_wave_and_surfer_at_sunset_--cha_e29a8438-d1af-43a9-9791-0261bd171f90_1.jpeg","Sunset Surf Session: A surfer gracefully maneuvers a powerful wave near dramatic coastal rocks at sunset, showcasing breathtaking ocean scenery and vibrant colors.","wave, sport, extreme sports, surfboard, water, nature, outdoors, men, surfing, summer, sunset, adventure, vacations, recreational pursuit, surf, fun, sun, sunlight, activity, coastline, speed, travel, leisure activity, splashing, blue, adult, tropical climate, travel destinations, motion, dusk, sand, nautical vessel, maui, spray, wet","Sports"
"imagetheyusifahmad_wooden_crate_full_of_oranges._Isolated_3d_rende_a2ef2db8-bb5c-4e59-9fe5-f083fbd2204d_1.jpeg","a rustic wooden crate brimming with fresh, juicy oranges","fruit, freshness, crate, food, nature, wood, material, ripe, healthy eating, organic, citrus fruit, box, container, agriculture, orange, close-up, leaf, yellow, summer, farm, tangerine, green color, isolated, outdoors, full, vegetarian food, basket, backgrounds, refreshment, lemon, container, dieting, juicy, vegetable, growth","Food"
