Filename,Title,Keywords,Category
"imagetheyusifahmad_Wasting_time_concept_alarm_clocks_in_the_trash__209f7656-63e3-4767-9c6b-72f27ba18df1_0.jpeg","Crumbling Time: three vintage alarm clocks buried in a pile of fragmented debris, a surreal representation of time's fleeting nature.","clock, alarm clock, time, minute hand, clock face, watch, countdown, old, midnight, number, waking up, timer, deadline, clock hand, night, success, close-up, reminder, second hand, alarm, single object, broken, indoors, confetti, backgrounds, old-fashioned, table, paper, hour hand, urgency, heap, metal, banking, ideas, business","States of Mind"
"imagetheyusifahmad_Broken_Brick_Wall_with_beautiful_landscape_behi_0cb21f11-6be5-4c72-baf1-b9c638a5ecba_3.jpeg","a glimpse of nature through a broken brick wall with a dark green door","brick, window, wall, building feature, architecture, old, backgrounds, nature, outdoors, green color, brick wall, building exterior, plant, dirty, built structure, leaf, close-up, pattern, tree, construction industry, material, facade, no people, design, abandoned, weathered, stone material, damaged, old-fashioned, summer, history, door, broken, cement, day","Buildings and Architecture"
"imagetheyusifahmad_Wasting_time_concept_alarm_clocks_in_the_trash__209f7656-63e3-4767-9c6b-72f27ba18df1_2.jpeg","a pile of forgotten antique clocks, time stands still","old, clock, time, old-fashioned, antique, metal, clock face, minute hand, close-up, obsolete, indoors, single object, equipment, alarm clock, instrument of measurement, direction, ancient, number, technology, watch, dirty, history, second hand, day, travel, accuracy, antiquities, no people, clock hand, speed, science, machine part, night, wood, material","Hobbies and Leisure"
"imagetheyusifahmad_Background_image_of_3D_--chaos_30_--ar_169_--st_64bdda58-3301-46c0-a4c8-840ab8d75ad7_0.jpeg","A mesmerizing installation of reflective spheres suspended in a minimalist architectural space.","decoration, celebration, glass, material, backgrounds, shiny, indoors, close-up, luxury, domestic room, design, elegance, sphere, table, modern, single object, reflection, chandelier, ornate, decor, bright, no people, collection, illuminated, cultures, new, crystal, christmas ornament, party, social event, drinking glass, gold, gift, circle, success","Buildings and Architecture"
"imagetheyusifahmad_Broken_Brick_Wall_with_beautiful_landscape_behi_0cb21f11-6be5-4c72-baf1-b9c638a5ecba_1.jpeg","A glimpse of nature through a crumbling brick wall: a window to the lush green forest beyond.","brick, old, wall, building feature, architecture, outdoors, backgrounds, nature, wood, material, building exterior, window, dirty, green color, construction industry, abandoned, close-up, built structure, weathered, old-fashioned, material, damaged, tree, leaf, pattern, concrete, brick wall, cement, plant, broken, design, history, indoors, rusty, domestic room","Buildings and Architecture"
"imagetheyusifahmad_Planet_earth_in_space_with_focus_on_European_co_69d3ef8e-6488-423a-8d4e-20b0931d18c0_1.jpeg","a breathtaking night view of europe from space, showcasing the intricate network of city lights against the backdrop of a dark, starlit sky","nature, landscape, aerial view, water, outdoors, sand, land, mountain, travel, high angle view, sunset, blue, backgrounds, coastline, pattern, environment, grass, summer, dirt, flying, drone, tree, forest, africa, rock, object, sun, season, extreme terrain, high up, wave, day, beauty in nature, physical geography, snow","Landscapes"
"imagetheyusifahmad_Set_of_Colorful_Scotch_adhesive_Tape_--chaos_30_5abd4cb5-da3b-4d13-bff6-62959bae9832_2.jpeg","Abstract Colorful Ribbons: A vibrant composition of swirling, multi-colored stripes creating a dynamic and visually engaging abstract artwork.","industry, metal, stack, backgrounds, pattern, shiny, rolled up, abstract, equipment, business finance and industry, circle, spiral, close-up, curve, no people, material, metallic, steel, shape, collection, design, in a row, technology, variation, multi colored, factory, spool, group of objects, colors, black color, new, plastic, reflection, heap, twisted","Graphic Resources"
"imagetheyusifahmad_U.S.A_3D_map_symbol_represented_by_a_blue_dimen_2b1d8bb9-061d-4f4e-912d-56c13fc893b1_3.jpeg","a detailed 3d model of serbia's topography, showcasing its mountainous terrain and geographical features in vibrant blue hues.","blue, nature, close-up, water, backgrounds, environment, technology, abstract, wave, travel, macro, no people, pattern, sand, material, grunge, science, design, wet, industry, concepts, space, backdrop, creativity, equipment, map, ideas, world map, physical geography, isolated, old, outdoors, single object, land, day","Travel"
"imagetheyusifahmad_U.S.A_3D_map_symbol_represented_by_a_blue_dimen_2b1d8bb9-061d-4f4e-912d-56c13fc893b1_2.jpeg","a 3d model of the usa showing the density of cities across the country","map, cartography, technology, industry, world map, global communications, blue, science, indoors, communication, modern, internet, data, backgrounds, travel, abstract, education, built structure, architecture, close-up, physical geography, table, computer, equipment, nature, illustration, old, planet, space, creativity, topography, design, window, men, no people","Technology"
"imagetheyusifahmad_Set_of_Colorful_Scotch_adhesive_Tape_--chaos_30_5abd4cb5-da3b-4d13-bff6-62959bae9832_3.jpeg","A vibrant collection of colorful adhesive tapes, showcasing a variety of hues and textures.","close-up, circle, multi colored, backgrounds, spool, colors, blue, single object, rolled up, collection, industry, yellow, equipment, plastic, metal, material, recycling, curve, isolated, stack, arrangement, repairing, pattern, work tool, paper, rubber, creativity, variation, wheel, fashion, heap, abstract, shiny, cylinder, hobbies","Graphic Resources"
"imagetheyusifahmad_Planet_earth_in_space_with_focus_on_European_co_69d3ef8e-6488-423a-8d4e-20b0931d18c0_0.jpeg","A breathtaking view of earth in a futuristic gallery: a journey into our planet's intricacies.","planet, space, world map, sphere, blue, global, map, space, science, nature, global communications, cartography, technology, travel, africa, physical geography, topography, men, global business, illustration, communication, environment, futuristic, abstract, planet earth, wide, globe, navigational equipment, backgrounds, concepts, computer graphic, land, ideas, businessman, business travel","The Environment"
"imagetheyusifahmad_Broken_Brick_Wall_with_beautiful_landscape_behi_0cb21f11-6be5-4c72-baf1-b9c638a5ecba_0.jpeg","a glimpse of a park through a damaged brick wall","brick, outdoors, old, architecture, nature, backgrounds, summer, building exterior, green color, wall, building feature, grass, tree, leaf, day, built structure, brick wall, construction industry, plant, material, history, design, backdrop, abandoned, space, old-fashioned, dirty, close-up, cement, weathered, rural scene, pattern, concrete, wood, sunlight","Buildings and Architecture"
"imagetheyusifahmad_Background_image_of_3D_--chaos_30_--ar_169_--st_64bdda58-3301-46c0-a4c8-840ab8d75ad7_1.jpeg","a mesmerizing cluster of crimson and mauve spheres, each subtly textured with tiny craters, creating a visually captivating abstract composition.","close-up, backgrounds, decoration, multi colored, pink color, celebration, nature, pattern, season, drop, shiny, blue, abstract, macro, freshness, colors, purple, animal egg, wet, circle, sphere, christianity, ball, large, group of objects, spotted, design, springtime, food, symbol, reflection, gift, glitter, ornate, cultures","Graphic Resources"
"imagetheyusifahmad_Wasting_time_concept_alarm_clocks_in_the_trash__209f7656-63e3-4767-9c6b-72f27ba18df1_3.jpeg","a pile of dusty vintage clocks and containers, a time capsule of forgotten moments","old, equipment, close-up, metal, old-fashioned, industry, single object, technology, obsolete, dirty, garbage, stack, backgrounds, steel, antique, collection, recycling, rusty, heap, work tool, transportation, glass, material, machinery, indoors, working, wood, material, metallic, machine part, liquid, large, group of objects, science, bottle","Hobbies and Leisure"
"imagetheyusifahmad_bobbins._3d_--chaos_30_--ar_169_--stylize_300_-_f00c3a80-2e81-4e17-b1f9-878c67873305_0.jpeg","intricate wooden gears and cogs: a 3d render of complex machinery","industry, equipment, machine part, wheel, technology, steel, metal, factory, machinery, engine, manufacturing, turning, engineering, part of, isolated, shiny, working, mechanic, close-up, vehicle part, workshop, repairing, metallic, business, circle, backgrounds, manufacturing equipment, occupation, iron, work tool, teamwork, motion, service, ball bearing, illustration","Industry"
"imagetheyusifahmad_ball_for_golf_on_a_red_background_--chaos_30_--_8c74a908-6ff0-484f-b77e-6c9b548d7dd9_0.jpeg","A solitary golf ball rests in a vibrant red, textured archway.","sport, ball, equipment, club, golf, pattern, backgrounds, circle, hole, no people, design, indoors, leather, sphere, competition, close-up, activity, abstract, decoration, hobbies, material, golf ball, modern, relaxation, shape, metal, sports equipment, fun, single object, curve, leisure games, space, clean, shiny, bright","Sports"
"imagetheyusifahmad_Earth_-_vector_illustration_in_three_colors_-_e_340bb3fb-a22a-4ac1-8847-40613a7c6d81_3.jpeg","three stylized globes depicting the earth in different colors against a dark blue background","blue, world map, planet, space, sphere, map, africa, global business, global, cartography, abstract, space, backgrounds, global communications, nature, environment, topography, physical geography, technology, concepts, communication, ideas, travel, illustration, symbol, futuristic, science, circle, design, no people, internet, glowing, night, land, close-up","The Environment"
"imagetheyusifahmad_Beautiful_sunset_--chaos_30_--ar_169_--stylize__9ec928ef-5496-4b38-90e0-efaf8b7a58e6_1.jpeg","a girl silhouetted against a fiery sunset over the ocean","sunset, nature, women, outdoors, sun, sunlight, dusk, summer, sunrise, dawn, water, vacations, beauty in nature, cloud, sky, one person, landscape, tranquil scene, lifestyles, relaxation, adult, back lit, coastline, wave, travel, men, seascape, silhouette, sand, beauty, dawn, rock, object, reflection, solitude","Landscapes"
"imagetheyusifahmad_miniature_golf_planet_concept_with_nice_grass_c_9daf4bca-7952-4152-911f-d0c772d7d017_0.jpeg","A giant grassy sphere rests on a manicured lawn beside a quaint red house.","grass, farm, lawn, nature, fruit, ball, meadow, tree, computer graphic, organic, agriculture, outdoors, landscape, food, environment, green color, sport, summer, freshness, plant, copy space, christianity, growth, blue, rural scene, healthy eating, activity, forest, no people, design, shadow, turf, sunlight, fence, yard","Landscapes"
"imagetheyusifahmad_concept_of_sustainable_development_with_Cube_pu_a9b2ca97-c6b6-42db-9771-dc22bd5fbefd_0.jpeg","a futuristic green cube structure floating amidst lush trees and a cloudy sky","nature, cloud, sky, blue, technology, architecture, outdoors, skyscraper, tree, backgrounds, success, computer graphic, environment, landscape, abstract, green color, pattern, design, summer, illustration, built structure, growth, flying, futuristic, plant, ideas, creativity, computer, shape, grass, day, industry, sun, leaf, construction industry","The Environment"
"imagetheyusifahmad_3D_render_of_a_lantern_--chaos_30_--ar_169_--st_d245c2d9-633b-4bc3-beae-c60321a63087_3.jpeg","a glowing lantern with intricate floral patterns casts a warm light, creating a serene and peaceful atmosphere.","lantern, ramadan, decoration, electric lamp, religion, celebration, cultures, lighting equipment, backgrounds, illuminated, arabia, window, arabic style, night, month, spirituality, decor, light, natural phenomenon, antique, ornate, indoors, old, shiny, glowing, wood, material, greeting, old-fashioned, design, candle, elegance, single object, arab culture, no people","Culture and Religion"
"imagetheyusifahmad_3d_tree_pack_-_render_on_white_background_--cha_b4467a15-b2a3-4b87-a0f5-d0b72bd4b160_1.jpeg","Collection of slender, elegant poplar trees against a bright white backdrop. Ideal for landscaping projects and 3D modeling.","tree, nature, plant, leaf, forest, branch, isolated, growth, summer, green color, environment, collection, grass, season, backgrounds, in a row, botany, landscape, outdoors, tree trunk, white background, no people, freshness, agriculture, winter, pine tree, springtime, design, organic, decoration, beauty in nature, flower, day, fruit, coniferous tree","Plants and Flowers"
"imagetheyusifahmad_globe_with_twisted_diagram_of_golden_coins_isol_ef9b7a9a-85c8-432f-8d28-200a786c0569_3.jpeg","a vintage globe with two bitcoins on it representing the global reach of cryptocurrency","map, isolated, antique, world map, physical geography, africa, old, sphere, cartography, planet, space, history, education, gold, science, white background, single object, old-fashioned, travel, topography, illustration, cultures, global, antiquities, nature, christianity, equipment, obsolete, gold colored, collection, backgrounds, globe, navigational equipment, land, global business","Business"
"imagetheyusifahmad_3D_balls_--chaos_30_--ar_169_--stylize_300_--we_c276c929-bee2-4b98-b9dd-e9d2fa87b260_2.jpeg","A mesmerizing cluster of dark, metallic spheres reflecting light, creating an abstract and captivating visual experience.","close-up, backgrounds, sphere, blue, shiny, abstract, glass, material, reflection, decoration, circle, science, single object, drop, pattern, nature, shape, multi colored, ball, medicine, wet, macro, metal, liquid, creativity, design, fashion, collection, symbol, healthcare and medicine, jewelry, steel, sport, technology, small","Graphic Resources"
"imagetheyusifahmad_Accident_of_a_red_car_isolated_on_a_white_backg_81830cea-644d-4cee-9c76-68b3fe08d6f3_0.jpeg","a severely damaged red car after a collision","car, land vehicle, transportation, speed, sports car, wheel, shiny, mode of transport, sport, luxury, isolated, motor vehicle, modern, engine, chrome, driving, headlight, sports race, new, technology, metal, racecar, tire, status car, traffic, elegance, alloy wheel, convertible, competition, design, sports utility vehicle, fuel and power generation, front view, performance, industry","Transport"
"imagetheyusifahmad_St._Patricks_hat_with_four-leaf_clover._3d_imag_88324c3e-dcbf-480b-a7d0-70d17969e5a8_1.jpeg","A festive green leprechaun hat with a four-leaf clover, celebrating St. Patrick's Day.","green color, leaf, close-up, celebration, fashion, irish culture, single object, clothing, cultures, leprechaun, decoration, backgrounds, nature, clover, textile, personal accessory, felt, men, luck, elegance, day, top hat, season, studio shot, plant, old-fashioned, garment, wealth, no people, isolated, concepts, buckle, symbol, springtime, party, social event","Culture and Religion"
"imagetheyusifahmad_branch_with_fresh_green_leaves_--chaos_30_--ar__22a1841a-7d3e-45cb-869e-a99da67f8abd_1.jpeg","Delicate branch with vibrant green and reddish leaves against a bright sky","leaf, nature, plant, tree, green color, branch, season, backgrounds, close-up, freshness, forest, outdoors, autumn, summer, yellow, environment, growth, springtime, bright, botany, beauty in nature, day, vibrant color, isolated, macro, colors, multi colored, organic, pattern, abstract, blue, october, sunlight, chestnut tree, design","Plants and Flowers"
"imagetheyusifahmad_Modern_Architecture_--chaos_30_--ar_169_--styli_368a7455-7c22-4f7a-82cf-fdc029a4e0ee_1.jpeg","a modern architectural marvel by the water, a woman with a backpack admires the building's unique design","women, outdoors, travel, architecture, adult, water, blue, one person, nature, modern, cityscape, building exterior, lifestyles, travel destinations, summer, tourist, tourism, skyscraper, city life, nautical vessel, men, young adult, vacations, built structure, famous place, education, looking, design, leisure activity, journey, day, fashion, caucasian ethnicity, ship, window","Buildings and Architecture"
"imagetheyusifahmad_Modern_Architecture_--chaos_30_--ar_169_--styli_368a7455-7c22-4f7a-82cf-fdc029a4e0ee_0.jpeg","Modern architectural design: minimalist homes nestled in a lush green landscape with a tranquil water feature.","architecture, outdoors, modern, blue, building exterior, summer, design, nature, tree, built structure, famous place, concrete, water, window, day, swimming pool, wall, building feature, skyscraper, city life, no people, green color, cityscape, lifestyles, sport, travel, grass, construction industry, springtime, landscape, sunlight, footpath, leaf, table, formal garden","Buildings and Architecture"
"imagetheyusifahmad_branch_with_fresh_green_leaves_--chaos_30_--ar__22a1841a-7d3e-45cb-869e-a99da67f8abd_0.jpeg","Serene spring branch with delicate new leaves emerging against a soft, blurred background.","leaf, nature, tree, branch, plant, outdoors, close-up, season, backgrounds, forest, autumn, beauty in nature, growth, springtime, freshness, green color, day, environment, summer, macro, vibrant color, yellow, bright, sunlight, botany, pattern, october, colors, twig, abstract, multi colored, wood, material, design, flower","Plants and Flowers"
"imagetheyusifahmad_St._Patricks_hat_with_four-leaf_clover._3d_imag_88324c3e-dcbf-480b-a7d0-70d17969e5a8_0.jpeg","a festive green leprechaun hat with a four-leaf clover on st. patrick's day","celebration, leaf, green color, irish culture, leprechaun, decoration, cultures, clover, luck, nature, illustration, gold, isolated, backgrounds, day, plant, season, traditional festival, fashion, tradition, symbol, grass, design, clothing, textile, men, costume, felt, single object, close-up, greeting, white background, springtime, copy space, no people","Culture and Religion"
"imagetheyusifahmad_Accident_of_a_red_car_isolated_on_a_white_backg_81830cea-644d-4cee-9c76-68b3fe08d6f3_1.jpeg","A severely damaged red car after a collision, showcasing extensive front-end damage.","car, land vehicle, transportation, speed, mode of transport, shiny, sport, wheel, sports car, engine, sports race, chrome, headlight, modern, driving, competition, luxury, metal, tire, performance, motor vehicle, traffic, isolated, illustration, front view, technology, single object, bumper, close-up, sports utility vehicle, machinery, crash, fuel and power generation, racecar, extreme sports","Transport"
"imagetheyusifahmad_3D_balls_--chaos_30_--ar_169_--stylize_300_--we_c276c929-bee2-4b98-b9dd-e9d2fa87b260_3.jpeg","A mesmerizing array of reflective spheres, suspended in harmonious disarray. each sphere, a universe of mirrored reflections and subtle light play, creating a captivating visual symphony.","glass, material, backgrounds, reflection, decoration, shiny, chandelier, electric lamp, luxury, design, lighting equipment, illuminated, celebration, close-up, nightclub, elegance, abstract, modern, crystal, transparent, illustration, indoors, ceiling, night, pattern, shape, bright, sphere, blue, three dimensional, drinking glass, domestic room, liquid, ornate, alcohol","Graphic Resources"
"imagetheyusifahmad_globe_with_twisted_diagram_of_golden_coins_isol_ef9b7a9a-85c8-432f-8d28-200a786c0569_2.jpeg","a vintage globe adorned with gold coins symbolizing global finance and wealth","sphere, planet, space, world map, illustration, nature, map, backgrounds, close-up, concepts, abstract, science, environment, cartography, physical geography, global business, single object, global communications, ideas, global, technology, isolated, pattern, ball, topography, travel, design, africa, symbol, macro, communication, water, creativity, shape, white background","Business"
"imagetheyusifahmad_3d_tree_pack_-_render_on_white_background_--cha_b4467a15-b2a3-4b87-a0f5-d0b72bd4b160_0.jpeg","Three lush, green trees standing side-by-side on a patch of grass against a bright white background. A perfect image for landscaping projects.","tree, nature, plant, grass, leaf, summer, green color, season, isolated, growth, branch, environment, forest, landscape, meadow, backgrounds, illustration, outdoors, design, springtime, vector, land, farm, day, agriculture, botany, freshness, organic, collection, lawn, rural scene, backdrop, wallpaper, flower, abstract","Plants and Flowers"
"imagetheyusifahmad_3D_render_of_a_lantern_--chaos_30_--ar_169_--st_d245c2d9-633b-4bc3-beae-c60321a63087_2.jpeg","Glowing lantern with intricate details, a warm light illuminating the night.","lantern, lighting equipment, electric lamp, cultures, decoration, single object, night, backgrounds, illuminated, ramadan, antique, close-up, celebration, glowing, old-fashioned, fire, natural phenomenon, glass, material, flame, religion, old, dark, heat, temperature, shiny, candle, light, natural phenomenon, outdoors, equipment, symbol, ornate, yellow, wood, material","Buildings and Architecture"
"imagetheyusifahmad_concept_of_sustainable_development_with_Cube_pu_a9b2ca97-c6b6-42db-9771-dc22bd5fbefd_1.jpeg","A large wooden puzzle piece floats against a backdrop of towering city buildings and a partly cloudy sky.  The scene is shot from a low angle, emphasizing the puzzle piece's prominence and the buildings' height.","architecture, success, skyscraper, puzzle, building exterior, blue, outdoors, ideas, cloud, sky, built structure, business, solution, concepts, cityscape, creativity, pattern, abstract, strategy, connection, technology, backgrounds, design, day, part of, development, symbol, window, modern, city life, businessman, low angle view, working, construction industry, teamwork","Buildings and Architecture"
"imagetheyusifahmad_miniature_golf_planet_concept_with_nice_grass_c_9daf4bca-7952-4152-911f-d0c772d7d017_1.jpeg","A miniature world: golf course, mansion, and lush green landscape on a spherical terrain","grass, golf, nature, sport, golf course, tree, ball, landscape, outdoors, activity, illustration, plant, isolated, design, lawn, summer, club, green color, sand, meadow, hole, hobbies, computer graphic, turf, leisure activity, water, equipment, high angle view, farm, backgrounds, land, white background, no people, digitally generated image, pattern","Landscapes"
"imagetheyusifahmad_Beautiful_sunset_--chaos_30_--ar_169_--stylize__9ec928ef-5496-4b38-90e0-efaf8b7a58e6_0.jpeg","Silhouette of a woman under a large tree at sunset, a breathtaking view of the cloudy sky","sunset, nature, silhouette, back lit, tree, outdoors, sun, sunlight, women, dusk, summer, men, cloud, sky, landscape, sunrise, dawn, beauty in nature, one person, adult, yellow, lifestyles, tranquil scene, relaxation, blue, beauty, dawn, orange color, forest, leisure activity, two, people, vacations, day, young adult","Landscapes"
"imagetheyusifahmad_Earth_-_vector_illustration_in_three_colors_-_e_340bb3fb-a22a-4ac1-8847-40613a7c6d81_2.jpeg","Global network connections: a visualization of three earth globes in different colors, showcasing interconnectedness.","world map, planet, space, map, blue, africa, sphere, global, cartography, illustration, global business, global communications, physical geography, abstract, backgrounds, topography, vector, space, nature, environment, communication, land, concepts, technology, symbol, travel, design, collection, ideas, computer graphic, circle, internet, isolated, shiny, planet earth","Technology"
"imagetheyusifahmad_ball_for_golf_on_a_red_background_--chaos_30_--_8c74a908-6ff0-484f-b77e-6c9b548d7dd9_1.jpeg","A single golf ball rests on a vibrant red surface, a minimalist study in contrast and texture.","sport, ball, golf, close-up, backgrounds, equipment, single object, golf ball, tee, activity, hobbies, competition, club, macro, pattern, leisure games, no people, sphere, design, hole, space, competitive sport, success, blue, sports equipment, circle, grass, abstract, studio shot, fun, golf course, playing, leisure activity, indoors, isolated","Sports"
"imagetheyusifahmad_bobbins._3d_--chaos_30_--ar_169_--stylize_300_-_f00c3a80-2e81-4e17-b1f9-878c67873305_1.jpeg","Intricate latticework spheres in warm hues: A mesmerizing 3D render of interconnected geometric forms.","decoration, souvenir, cultures, pattern, backgrounds, multi colored, close-up, craft, design, indoors, religion, collection, travel, ornate, tourism, abstract, nature, no people, symbol, east asian culture, food, single object, christianity, decor, shape, gift, equipment, fashion, retail, travel destinations, large, group of objects, yellow, indigenous culture, sphere","Graphic Resources"
"imagetheyusifahmad_ball_for_golf_on_a_red_background_--chaos_30_--_8c74a908-6ff0-484f-b77e-6c9b548d7dd9_3.jpeg","a perfectly spherical golf ball rests on a crimson surface, ready for the next swing.","ball, sport, golf, close-up, golf ball, activity, equipment, no people, hobbies, tee, club, single object, competition, leisure games, isolated, sphere, copy space, backgrounds, sports equipment, studio shot, macro, success, circle, hole, pattern, playing, leisure activity, fun, relaxation, grass, accuracy, shadow, golf course, abstract, bright","Sports"
"imagetheyusifahmad_bobbins._3d_--chaos_30_--ar_169_--stylize_300_-_f00c3a80-2e81-4e17-b1f9-878c67873305_3.jpeg","a colorful array of hanging yarn spools creating a vibrant textile art installation","backgrounds, multi colored, collection, pattern, design, colors, abstract, stack, indoors, decoration, close-up, fashion, illustration, variation, industry, equipment, shape, clothing, no people, modern, creativity, backdrop, material, large, group of objects, textile, yellow, heap, cultures, factory, retail, circle, business, abundance, vector","Graphic Resources"
