Filename,Title,Keywords,Category
"imagetheyusifahmad_Cloud_Computing_Concept_--chaos_30_--ar_169_--s_182c4112-61cc-4282-bbea-0a45344f7c31_3.jpeg","illuminated cloud network: a digital representation of interconnected data streams","night, technology, abstract, glowing, backgrounds, bright, data, motion, futuristic, computer network, backdrop, science, fire, natural phenomenon, exploding, design, speed, blue, shiny, communication, heat, temperature, pattern, network server, electricity, dark, flame, lighting equipment, computer, illustration, connection, computer graphic, multi colored, space, concepts","Technology"
"imagetheyusifahmad_Brain_--chaos_30_--ar_169_--stylize_300_--weird_a583d45e-cb1f-49aa-916d-195b99143615_1.jpeg","a colorful brain dripping into a vibrant ocean, symbolizing creativity and imagination","science, human brain, anatomy, intelligence, illustration, creativity, ideas, human internal organ, healthcare and medicine, abstract, brain, biology, human nervous system, medicine, concepts, blue, men, human head, technology, imagination, education, mental health, multi colored, backgrounds, cerebellum, inspiration, design, illness, cerebrum, digitally generated image, biomedical illustration, computer graphic, futuristic, three dimensional, contemplation","States of Mind"
"imagetheyusifahmad_Diamond_with_blue_shade_--chaos_30_--ar_169_--s_75ec8b8a-975d-495b-a1b5-db787fac256a_3.jpeg","a mesmerizing close-up of a vibrant blue crystal, showcasing its intricate facets and captivating texture","close-up, backgrounds, blue, gemstone, crystal, nature, shiny, glass, material, transparent, abstract, pattern, macro, ice, stone, object, jewelry, bright, ice crystal, precious gem, vibrant color, reflection, fashion, rock, object, quartz, drop, shape, multi colored, single object, illuminated, refraction, decoration, beauty in nature, frost","Science"
"imagetheyusifahmad_Contemporary_architecture._Isolated_on_white_--_e67b71da-59fd-4830-a0c5-af978ce43b10_1.jpeg","Modern architecture house nestled in a lush green landscape, showcasing a perfect blend of natural wood and sleek white exteriors. ","grass, architecture, design, outdoors, nature, green color, summer, modern, window, plant, tree, wood, material, lawn, residential district, building exterior, lifestyles, landscape, formal garden, home ownership, no people, domestic room, day, staircase, backgrounds, construction industry, fence, meadow, front or back yard, balcony, illustration, roof, flower, facade, wall, building feature","Buildings and Architecture"
"imagetheyusifahmad_3D_illustration_of_pink_cubes_--chaos_30_--ar_1_f942cae1-84db-4878-86e0-2b777f623099_3.jpeg","Abstract composition of fuchsia cubes: a vibrant 3D rendering of geometric shapes","abstract, backgrounds, pattern, backdrop, design, geometric shape, technology, cube shape, shape, futuristic, modern, computer graphic, box, container, creativity, architecture, construction industry, decoration, digitally generated image, science, built structure, illustration, square shape, light, natural phenomenon, rectangle, three dimensional, concepts, no people, space, wallpaper, shiny, wall, building feature, multi colored","Graphic Resources"
"imagetheyusifahmad_Beautiful_autumn_sunset_--chaos_30_--ar_169_--s_98127d5c-63ca-4a17-a733-8425cb0c6c5f_0.jpeg","Golden hour serenity: a lone figure contemplates the autumnal landscape bathed in sunset's warm embrace.","nature, outdoors, sunset, landscape, forest, sunlight, men, one person, autumn, sun, hiking, adventure, mountain, sunrise, dawn, women, travel, tree, leisure activity, lifestyles, adult, beauty in nature, rural scene, recreational pursuit, backpack, tourist, yellow, relaxation, sport, healthy lifestyle, rear view, mountain peak, activity, tranquil scene, summer","Landscapes"
"imagetheyusifahmad_Abstract_Background_--chaos_30_--ar_169_--styli_1d6b7be0-64c5-43a2-92a4-1f2a06bbfd23_1.jpeg","abstract red and black paint strokes: a dynamic interplay of color and form","men, illustration, grunge, abstract, paint, vector, backgrounds, creativity, dirty, one person, ink, painted image, stained, silhouette, adult, brush stroke, drop, messy, backdrop, computer graphic, paintbrush, acrylic painting, design, sketch, multi colored, pattern, drawing, art product, colors, rough, women, symbol, splashing, spray, old","Graphic Resources"
"imagetheyusifahmad_Stem_cell_research_conceptual_computer_artwork__c48a7cbf-2533-4227-9204-11f397718cbd_3.jpeg","Microscopic view of red blood cells flowing through a vessel. a detailed 3d rendering of human blood cells.","cell, science, blood, bacterium, magnification, illness, healthcare and medicine, biology, microbiology, high-scale magnification, medicine, virus, cancer cell, human cell, molecular structure, anatomy, illustration, macro, micro organism, fat, tumor, close-up, immunology, cancer, nature, backgrounds, antibody, blue, molecule, research, flu virus, human vein, small, stomach, abstract","Science"
"imagetheyusifahmad_Global_Search_-_Asia_--chaos_30_--ar_169_--styl_bc441305-fbbe-4f1e-9409-311fce19b0e7_2.jpeg","Wooden figurines of asian women near antique globes at a market.","cultures, religion, travel, women, statue, spirituality, souvenir, figurine, sculpture, tourism, decoration, toy, famous place, buddhism, travel destinations, sphere, world map, indigenous culture, indoors, map, tourist, africa, craft, east asian culture, doll, planet, space, antiquities, adult, antique, symbol, pottery, old, multi colored, small","Culture and Religion"
"imagetheyusifahmad_green_earth_and_leaves_--chaos_30_--ar_169_--st_3b83b040-3fc5-4008-b06d-d2535eba1b46_2.jpeg","a globe resting on autumn leaves near a forest, symbolizing the delicate balance of our planet's ecosystem.","nature, leaf, environment, planet, space, world map, forest, tree, sphere, blue, land, autumn, water, green color, map, topography, backgrounds, plant, space, global, outdoors, physical geography, cartography, environmental conservation, global communications, travel, season, close-up, global business, ideas, dirt, concepts, sunlight, beauty in nature, weather","The Environment"
"imagetheyusifahmad_Vector_set_of_announcement_arrows_--chaos_30_--_52ce6fab-d8c3-4a58-9735-1ba0be8ed6ec_0.jpeg","A collection of colorful arrows pointing upwards, symbolizing progress and achievement.","arrow symbol, direction, illustration, growth, symbol, vector, collection, design, success, abstract, moving up, icon, sign, progress, shape, ideas, pointing, set, multi colored, chart, development, isolated, creativity, cursor, flat, motion, aiming, modern, directional sign, computer graphic, diagram, decoration, wallpaper, competition, grunge","Graphic Resources"
"imagetheyusifahmad_Vector_set_of_announcement_arrows_--chaos_30_--_52ce6fab-d8c3-4a58-9735-1ba0be8ed6ec_1.jpeg","A collection of upward and downward pointing arrows, intricately designed with architectural blueprints, showcasing various shapes and orientations.","arrow symbol, direction, growth, sign, symbol, success, moving up, illustration, development, abstract, collection, design, ideas, computer graphic, business, motion, progress, concepts, chart, shape, cursor, creativity, directional sign, data, finance, diagram, pointing, backgrounds, the way forward, make, money, set, digitally generated image, strategy, aiming","Graphic Resources"
"imagetheyusifahmad_green_earth_and_leaves_--chaos_30_--ar_169_--st_3b83b040-3fc5-4008-b06d-d2535eba1b46_3.jpeg","a verdant world map embedded in a lush forest: a vision of environmental harmony","nature, landscape, water, aerial view, mountain, tree, grass, forest, environment, outdoors, travel, green color, land, plant, summer, cliff, meadow, adventure, coastline, high angle view, map, drone, blue, rural scene, ravine, growth, topography, beauty in nature, sand, tourism, physical geography, flying, no people, farm, leaf","The Environment"
"imagetheyusifahmad_Global_Search_-_Asia_--chaos_30_--ar_169_--styl_bc441305-fbbe-4f1e-9409-311fce19b0e7_3.jpeg","Serene buddha statue meditating amidst misty mountains and tranquil waters.","religion, buddhism, cultures, statue, nature, spirituality, men, illustration, sitting, travel, relaxation, outdoors, god, yoga, mountain, meditating, water, sculpture, landscape, old, chinese culture, tranquil scene, famous place, history, one person, east asian culture, lotus position, balance, rock, object, painted image, old-fashioned, antique, travel destinations, stone, object","Culture and Religion"
"imagetheyusifahmad_Stem_cell_research_conceptual_computer_artwork__c48a7cbf-2533-4227-9204-11f397718cbd_2.jpeg","Abstract spheres with metallic texture and cosmic background","backgrounds, illustration, science, multi colored, abstract, nature, pattern, decoration, sphere, close-up, futuristic, space, design, shiny, fantasy, technology, reflection, fractal, animal, blue, circle, galaxy, night, celebration, shape, glowing, creativity, backdrop, planet, season, molecular structure, nebula, computer graphic, colors, liquid","Graphic Resources"
"imagetheyusifahmad_Abstract_Background_--chaos_30_--ar_169_--styli_1d6b7be0-64c5-43a2-92a4-1f2a06bbfd23_0.jpeg","abstract swirling green patterns resembling fabric or scales, creating a mesmerizing visual texture","abstract, backgrounds, pattern, futuristic, fractal, illustration, design, backdrop, shape, fantasy, curve, multi colored, decoration, creativity, computer graphic, motion, modern, space, wave, spiral, science, geometric shape, chaos, digitally generated image, technology, blue, bright, shiny, smooth, colors, wallpaper, circle, mystery, nebula, imagination","Graphic Resources"
"imagetheyusifahmad_Beautiful_autumn_sunset_--chaos_30_--ar_169_--s_98127d5c-63ca-4a17-a733-8425cb0c6c5f_1.jpeg","A serene autumn landscape: wooden bridge over calm lake, golden leaves, misty sunrise","nature, autumn, outdoors, tree, forest, landscape, water, leaf, beauty in nature, wood, material, season, yellow, rural scene, tranquil scene, sunlight, bridge, man made structure, mountain, sunset, footpath, travel, sun, non-urban scene, reflection, day, green color, summer, sunrise, dawn, tranquility, blue, dusk, branch, jetty","Landscapes"
"imagetheyusifahmad_3D_illustration_of_pink_cubes_--chaos_30_--ar_1_f942cae1-84db-4878-86e0-2b777f623099_2.jpeg","abstract pink cubes and spheres: a 3d rendering of a modern art installation","backgrounds, abstract, pattern, close-up, success, technology, ideas, concepts, shape, design, large, group of objects, science, three dimensional, shiny, medicine, no people, creativity, equipment, symbol, single object, illustration, reflection, leisure games, communication, healthcare and medicine, sport, teamwork, decoration, digitally generated image, computer graphic, competition, order, computer, business","Graphic Resources"
"imagetheyusifahmad_Diamond_with_blue_shade_--chaos_30_--ar_169_--s_75ec8b8a-975d-495b-a1b5-db787fac256a_2.jpeg","a sparkling diamond reflecting vibrant colors on a dark, reflective surface","close-up, reflection, shiny, gemstone, backgrounds, luxury, glass, material, single object, jewelry, crystal, precious gem, fashion, stone, object, gold, wealth, transparent, multi colored, blue, vibrant color, macro, shape, yellow, bright, drinking glass, elegance, nature, gift, metal, wet, liquid, ice, decoration, drop","Graphic Resources"
"imagetheyusifahmad_Contemporary_architecture._Isolated_on_white_--_e67b71da-59fd-4830-a0c5-af978ce43b10_0.jpeg","Futuristic capsule-shaped building design: a modern architectural marvel with intricate white latticework and expansive glass windows.","transportation, architecture, modern, travel, mode of transport, no people, window, traffic, bus, public transportation, built structure, car, cityscape, speed, building exterior, motion, glass, material, city life, futuristic, design, reflection, outdoors, luxury, passenger, land vehicle, tourism, travel destinations, skyscraper, nautical vessel, commuter, blue, facade, vacations, business travel","Buildings and Architecture"
"imagetheyusifahmad_Brain_--chaos_30_--ar_169_--stylize_300_--weird_a583d45e-cb1f-49aa-916d-195b99143615_0.jpeg","a mesmerizing portrait of a biomechanical woman, showcasing intricate details of her cybernetic anatomy against a blurred urban backdrop.","men, adult, portrait, one person, women, human head, human face, statue, young adult, close-up, science, males, indoors, sculpture, futuristic, cultures, religion, mannequin, creativity, headshot, beauty, caucasian ethnicity, architecture, naked, outdoors, profile view, craft, profile, robot, industry, torso, working, looking, spirituality, lifestyles","Graphic Resources"
"imagetheyusifahmad_Cloud_Computing_Concept_--chaos_30_--ar_169_--s_182c4112-61cc-4282-bbea-0a45344f7c31_2.jpeg","The interconnected world of cloud computing: a server and digital cloud connected by streams of data","data, network server, technology, cloud computing, computer network, internet, computer, communication, global communications, connection, security system, futuristic, mainframe, blue, computer equipment, order, network security, it support, security, equipment, computer part, service, cloud, sky, digitally generated image, concepts, business, information medium, design, computer graphic, science, storage compartment, binary code, networking, network connection plug","Technology"
"imagetheyusifahmad_Cloud_Computing_Concept_--chaos_30_--ar_169_--s_182c4112-61cc-4282-bbea-0a45344f7c31_0.jpeg","secure cloud network: a hand interacts with a digital representation of interconnected cloud servers, each secured with a padlock, symbolizing data protection and secure online storage.","technology, internet, data, cloud computing, connection, communication, symbol, computer, wireless technology, business, security, blue, cloud, sky, concepts, security system, network server, equipment, global communications, computer network, futuristic, global, ideas, computer graphic, telephone, sign, computer icon, padlock, businessman, touching, design, computer equipment, lock, accessibility, science","Technology"
"imagetheyusifahmad_Brain_--chaos_30_--ar_169_--stylize_300_--weird_a583d45e-cb1f-49aa-916d-195b99143615_2.jpeg","a detailed 3d rendering of interconnected brains illustrating neural networks","science, human nervous system, biology, human brain, nerve cell, healthcare and medicine, anatomy, nature, illness, synapse, close-up, cell, medicine, micro organism, magnification, macro, microbiology, human cell, illustration, organic, research, human internal organ, receptor, plant, bacterium, dendrite, backgrounds, blood, technology, concepts, nucleus, brain, molecular structure, abstract, membrane","Science"
"imagetheyusifahmad_Contemporary_architecture._Isolated_on_white_--_e67b71da-59fd-4830-a0c5-af978ce43b10_2.jpeg","minimalist architecture: a modern floating house design","design, illustration, architecture, modern, isolated, blank, space, backgrounds, vector, abstract, shape, backdrop, success, single object, indoors, clean, packet, domestic room, symbol, empty, no people, decoration, presentation, built structure, business, shiny, window, new, icon, luxury, roof, wallpaper, table, industry, vanishing point","Buildings and Architecture"
"imagetheyusifahmad_Diamond_with_blue_shade_--chaos_30_--ar_169_--s_75ec8b8a-975d-495b-a1b5-db787fac256a_0.jpeg","Silhouetted figures contemplate a luminous diamond monument overlooking a glittering cityscape at twilight.","skyscraper, cityscape, success, architecture, businessman, men, blue, futuristic, night, urban skyline, reflection, business, building exterior, illuminated, city life, built structure, shiny, outdoors, bright, famous place, dusk, glowing, wealth, adult, nightlife, sunset, modern, technology, symbol, backgrounds, leadership, innovation, one person, travel, flooring","Business"
"imagetheyusifahmad_Beautiful_autumn_sunset_--chaos_30_--ar_169_--s_98127d5c-63ca-4a17-a733-8425cb0c6c5f_3.jpeg","Sunbeams bursting through the golden leaves of an autumnal forest, illuminating the majestic tree trunk.","tree, autumn, nature, leaf, forest, yellow, season, outdoors, sunlight, branch, sun, plant, landscape, beauty in nature, day, rural scene, sunset, multi colored, tree trunk, bright, october, vibrant color, environment, tranquil scene, colors, backgrounds, back lit, non-urban scene, green color, orange color, gold colored, beauty, maple tree, pattern, no people","Landscapes"
"imagetheyusifahmad_3D_illustration_of_pink_cubes_--chaos_30_--ar_1_f942cae1-84db-4878-86e0-2b777f623099_0.jpeg","Abstract Pink Cube Background: A 3D Render of Interlocking Cubes in Vibrant Pink Hues","abstract, backgrounds, pattern, technology, modern, design, shape, backdrop, geometric shape, architecture, cube shape, construction industry, futuristic, built structure, computer graphic, creativity, concepts, no people, decoration, box, container, digitally generated image, ideas, three dimensional, close-up, pink color, computer, vanishing point, brick, large, group of objects, blue, science, industry, light, natural phenomenon","Graphic Resources"
"imagetheyusifahmad_Abstract_Background_--chaos_30_--ar_169_--styli_1d6b7be0-64c5-43a2-92a4-1f2a06bbfd23_2.jpeg","abstract strokes of gold and purple on a deep blue canvas: an exploration of texture and form","backgrounds, abstract, multi colored, pattern, futuristic, illustration, design, creativity, backdrop, night, vibrant color, colors, bright, modern, decoration, technology, computer graphic, glowing, shape, motion, blurred motion, blue, space, curve, illuminated, fractal, chaos, dark, shiny, electricity, science, yellow, striped, close-up, defocused","Graphic Resources"
"imagetheyusifahmad_Stem_cell_research_conceptual_computer_artwork__c48a7cbf-2533-4227-9204-11f397718cbd_0.jpeg","a microscopic view of interconnected neurons, a complex network of neural pathways in the brain.","science, biology, cell, healthcare and medicine, illness, nerve cell, human cell, medicine, human nervous system, magnification, illustration, human brain, human internal organ, bacterium, synapse, blood, microbiology, molecular structure, cancer, high-scale magnification, micro organism, backgrounds, shape, abstract, virus, dead person, cancer cell, anatomy, no people, tumor, research, organic, receptor, molecule, nature","Science"
"imagetheyusifahmad_Global_Search_-_Asia_--chaos_30_--ar_169_--styl_bc441305-fbbe-4f1e-9409-311fce19b0e7_1.jpeg","A coastal region map depicting ancient asian architecture, temples, and villages.","religion, aerial view, cultures, famous place, water, nautical vessel, travel, high angle view, architecture, travel destinations, nature, christianity, outdoors, history, buddhism, spirituality, drone, landscape, tourism, ancient, journey, ship, old, sand, vacations, cityscape, god, map, backgrounds, above, coastline, statue, flying, wave, illustration","Culture and Religion"
"imagetheyusifahmad_green_earth_and_leaves_--chaos_30_--ar_169_--st_3b83b040-3fc5-4008-b06d-d2535eba1b46_1.jpeg","a weathered globe nestled amongst lush green foliage, symbolizing the delicate balance of our planet and the importance of environmental conservation","nature, leaf, environment, green color, tree, planet, space, plant, environmental conservation, world map, forest, travel, outdoors, growth, africa, sphere, backgrounds, map, summer, close-up, global, branch, land, global business, blue, water, technology, global communications, physical geography, freshness, organic, space, topography, symbol, concepts","The Environment"
"imagetheyusifahmad_Vector_set_of_announcement_arrows_--chaos_30_--_52ce6fab-d8c3-4a58-9735-1ba0be8ed6ec_3.jpeg","Collection of orange and green arrow icons with a question mark","direction, symbol, sign, arrow symbol, illustration, collection, vector, design, pointing, set, computer graphic, computer icon, moving up, shape, icon, directional sign, growth, abstract, isolated, cursor, circle, icon set, connection, multi colored, design element, creativity, data, choice, button, ideas, label, internet, guidance, variation, business","Graphic Resources"
"imagetheyusifahmad_Vector_set_of_announcement_arrows_--chaos_30_--_52ce6fab-d8c3-4a58-9735-1ba0be8ed6ec_2.jpeg","A collection of hand-drawn arrows pointing in various directions, with a textured and colorful design.","direction, arrow symbol, sign, symbol, illustration, collection, growth, design, pointing, directional sign, vector, set, business, abstract, success, data, moving up, progress, computer graphic, guidance, ideas, icon, choice, creativity, multi colored, cursor, chart, shape, computer icon, yellow, motion, circle, planning, aiming, connection","Graphic Resources"
"imagetheyusifahmad_green_earth_and_leaves_--chaos_30_--ar_169_--st_3b83b040-3fc5-4008-b06d-d2535eba1b46_0.jpeg","A wooden globe adorned with moss, nestled amongst lush green leaves and a mossy stone wall. A picturesque representation of environmental harmony.","leaf, nature, tree, autumn, plant, green color, environment, forest, outdoors, wood, material, season, water, backgrounds, yellow, october, growth, branch, grass, freshness, multi colored, summer, close-up, old, sphere, botany, pattern, beauty in nature, organic, animal, rural scene, no people, day, christianity, travel","The Environment"
"imagetheyusifahmad_Global_Search_-_Asia_--chaos_30_--ar_169_--styl_bc441305-fbbe-4f1e-9409-311fce19b0e7_0.jpeg","A bronze statue of a woman pointing at an antique map of Southeast Asia, bathed in warm light","women, one person, religion, cultures, architecture, adult, nature, men, statue, outdoors, old, sunset, sculpture, spirituality, young adult, illustration, history, famous place, buddhism, travel, beauty, standing, backgrounds, old ruin, landscape, creativity, ancient, symbol, old-fashioned, lifestyles, travel destinations, fashion, forest, multi colored, god","Culture and Religion"
"imagetheyusifahmad_Stem_cell_research_conceptual_computer_artwork__c48a7cbf-2533-4227-9204-11f397718cbd_1.jpeg","a microscopic view of cells, showing intricate details and textures of a cellular structure. the image has a reddish-brown hue and a blurry background, creating a sense of depth and mystery.","close-up, backgrounds, blood, pattern, nature, medicine, abstract, science, macro, cell, biology, magnification, microbiology, research, illness, circle, food, bacterium, healthcare and medicine, organic, membrane, isolated, decoration, equipment, animal, shape, microscope, high-scale magnification, human cell, technology, design, water, hospital, backdrop, wet","Science"
"imagetheyusifahmad_Abstract_Background_--chaos_30_--ar_169_--styli_1d6b7be0-64c5-43a2-92a4-1f2a06bbfd23_3.jpeg","Serene slumber: a crimson metallic sculpture of a woman's head resting on flowing, abstract waves.","women, adult, one person, sensuality, young adult, beauty, abstract, futuristic, illustration, portrait, men, human face, creativity, backgrounds, motion, females, caucasian ethnicity, studio shot, fantasy, naked, one, woman, fashion model, blue, close-up, human hair, fashion, multi colored, brown hair, pattern, profile view, curve, design, modern, elegance","Graphic Resources"
"imagetheyusifahmad_3D_illustration_of_pink_cubes_--chaos_30_--ar_1_f942cae1-84db-4878-86e0-2b777f623099_1.jpeg","Abstract 3D Rendering of Exploding Pink and White Cubes: A Dynamic Composition of Geometric Shapes","abstract, backgrounds, design, technology, futuristic, backdrop, shape, creativity, computer graphic, modern, illustration, geometric shape, pattern, vector, cube shape, box, container, science, motion, wallpaper, computer, blue, exploding, construction industry, space, architecture, levitation, decoration, multi colored, concepts, chaos, three dimensional, colors, digitally generated image, flying","Graphic Resources"
"imagetheyusifahmad_Beautiful_autumn_sunset_--chaos_30_--ar_169_--s_98127d5c-63ca-4a17-a733-8425cb0c6c5f_2.jpeg","Autumnal Serenity: A majestic tree beside a tranquil lake at sunset, leaves floating gently on the water's surface, sun rays breaking through the branches.","nature, tree, autumn, outdoors, sunset, landscape, leaf, forest, season, sun, sunlight, water, yellow, beauty in nature, reflection, tranquil scene, dusk, branch, sunrise, dawn, plant, rural scene, summer, dawn, day, grass, tranquility, travel, non-urban scene, pond, environment, blue, back lit, bright, weather","Landscapes"
"imagetheyusifahmad_Contemporary_architecture._Isolated_on_white_--_e67b71da-59fd-4830-a0c5-af978ce43b10_3.jpeg","A striking architectural marvel: the deconstructed building design with rusty accents and a unique network of structural elements.","industry, construction industry, architecture, outdoors, wood, material, construction site, transportation, modern, metal, shipping, built structure, steel, building exterior, old, design, cargo container, stack, nautical vessel, window, commercial dock, roof, crane, construction machinery, material, freight transportation, working, construction frame, technology, building, activity, equipment, warehouse, no people, timber","Buildings and Architecture"
"imagetheyusifahmad_Diamond_with_blue_shade_--chaos_30_--ar_169_--s_75ec8b8a-975d-495b-a1b5-db787fac256a_1.jpeg","a mesmerizing close-up of a gemstone ring, showcasing the intricate details and vibrant colors of the red and teal jewel.","shiny, close-up, gemstone, jewelry, reflection, luxury, backgrounds, single object, gold, wealth, crystal, glass, material, precious gem, macro, blue, nature, transparent, fashion, gift, bright, gold colored, platinum, stone, object, vibrant color, elegance, drop, personal accessory, love, glamour, yellow, beauty, romance, celebration","Lifestyle"
